compound,Alias,target_class,specific_target,indication,max_phase,year-approved,year_stopped,primary_safety_signal,category,therapeutic_area,failure_type,MedChem_Descriptor_Tag,Outcome_Granularity,isomeric,inchikey,cid,status,year_clean,Edward Score V20,Rationale V20,metabolic_stability_estimate,potential_toxic_fragments,P1 Prob V20,P1 Rationale V20,P2 Prob V20,P2 Rationale V20,P3 Prob V20,P3 Rationale V20,TCSP V20
asoprisnil,,Selective progesterone receptor modulator (SPRM),Progesterone Receptor (selective modulation),Uterine fibroids; endometriosis (studied),Phase 3,,2009,Endometrial changes (PAEC) raised safety/regulatory concerns,clinical_failure,Reproductive,tox_safety,endometrial_safety,Discontinued for safety/tox,C[C@]12C[C@@H](C3=C4CCC(=O)C=C4CC[C@H]3[C@@H]1CC[C@]2(COC)OC)C5=CC=C(C=C5)/C=N/O,GJMNAFGEUJBOCE-MEQIQULJSA-N,9577221,OK,2009.0,68,"This molecule is a classic example of 'Old School' medicinal chemistry: taking a privileged, greasy scaffold (steroid) and decorating it to force novelty or selectivity, resulting in a physicochemical brick. 

1. **The Grease Tax**: The addition of the 11-aryl moiety to the steroid core pushes the cLogP into the danger zone (>4.5). While this substitution is necessary for antagonistic activity (breaking the active helix 12 conformation), it incurs a massive lipophilicity penalty. You are relying entirely on hydrophobic collapse for binding energy, which correlates strongly with promiscuity and attrition.

2. **Structural Liability (The Oxime)**: The benzaldoxime moiety (`/C=N/O`) is a metabolic soft spot. While less basic than the dimethylaniline found in related competitors, oximes are prone to Phase II glucuronidation (rapid clearance) and hydrolysis (releasing hydroxylamine, a potential mutagen). Furthermore, E/Z isomerization can lead to a 'wandering' potency profile.

3. **DILI Risk (Rule of Two)**: This scaffold belongs to the 11-substituted steroid class, which carries a dark cloud of Drug-Induced Liver Injury (DILI) in the clinic. The combination of high lipophilicity (cLogP > 4) and the likely high daily dose (>10mg) required for nuclear receptor modulation triggers a severe safety alert. The liver will struggle to clear this grease ball without generating reactive metabolites.

4. **Complexity**: With multiple chiral centers and a semi-synthetic origin, the cost-of-goods (COGS) and purification of the oxime isomers will be non-trivial.

**Tox Summary**: NOT CLEAN. High risk of DILI and potential genotox from oxime hydrolysis products.",Low,"Benzaldoxime (Hydroxylamine release), Conjugated Enone (Michael Acceptor), 11-Aryl-Steroid Core (DILI Pharmacophore)",0.75,"Steroid scaffolds generally possess sufficient permeability and exposure to clear Phase 1 safety, provided the oxime doesn't trigger immediate genotox signals.",0.4,"Target engagement is likely high due to the privileged scaffold, but the metabolic half-life (glucuronidation of oxime) may limit efficacy or require b.i.d. dosing.",0.1,Chronic safety is the killer here. The history of 11-aryl steroids suggests a high probability of late-stage failure due to liver toxicity or endometrial safety issues driven by the molecule's promiscuous nature.,0.32
AZD-4017,,11b-HSD1 inhibitor,11beta-hydroxysteroid dehydrogenase type 1,Metabolic disease (studied),Phase 2,,2021,Efficacy issues,clinical_failure,Metabolic,efficacy,efficacy_failure,Discontinued for efficacy,CCCSC1=C(C=CC(=N1)N2CCC[C@H](C2)CC(=O)O)C(=O)NC3CCCCC3,NCDZABJPWMBMIQ-INIZCTEOSA-N,24946280,OK,2021.0,42,"This molecule exhibits the classic 'Fatty Acid Mimetic' architecture, likely targeting a GPCR for medium-chain fatty acids (e.g., GPR84) or similar lipid-sensing machinery. While the physicochemical properties (MW ~419, TPSA ~85) are nominally within the 'Goldilocks' zone, the structure relies on 'lazy' medicinal chemistry tactics to achieve potency. 

1. **The Thioether Liability**: The S-propyl group at the 2-position is a metabolic ticking time bomb. Alkyl-aryl thioethers are rapidly oxidized to sulfoxides and sulfones, creating a 'moving target' for PK/PD. Furthermore, volatile sulfur metabolites can cause organoleptic issues (patient breath/sweat odor) in high-dose scenarios. Replace with an ether (-O-) or alkyl (-CH2-) bioisostere immediately.

2. **The Glucuronide Trap**: The acetic acid tail (attached to the piperidine) is sterically unhindered. This invites the formation of acyl glucuronides, which are reactive electrophiles capable of covalent protein binding and subsequent immune-mediated DILI. A bioisostere (e.g., tetrazole) or steric shielding (alpha-methylation) is required.

3. **The Grease**: The cyclohexyl amide is a generic lipophilic filler. It contributes to binding energy via entropy but adds metabolic liability (hydroxylation). 

4. **CNS Exclusion**: The carboxylic acid effectively confines this molecule to the periphery. If this is a CNS program, the score drops to 90 (Fail). Assuming a peripheral target, the acid aids solubility but remains a toxicity flag.

Tox Summary: Not Clean (Acyl Glucuronide & Reactive Sulfur risks).",Medium,"Unhindered Carboxylic Acid (Acyl Glucuronide risk), Alkyl-Aryl Thioether (Redox cycling/Sulfoxide formation)",0.75,"Reasonable safety profile for Phase 1, provided the S-oxidation metabolites are not disproportionately toxic. hERG risk is low due to the zwitterionic nature and lack of a strong basic center.",0.35,Efficacy is the hurdle. Lipid-mimetic antagonists often struggle with competing against high endogenous ligand concentrations. The 'moving target' of sulfide/sulfoxide ratios complicates dose-finding.,0.15,Chronic safety is the killer. The combination of an acyl glucuronide-forming acid and a sulfur redox center elevates the risk of idiosyncratic DILI in large populations.,0.58
AZD-4901,,NK3 receptor (TACR3) antagonist,Neurokinin 3 (NK3) receptor,Menopausal vasomotor symptoms (hot flushes),Phase 2,,2017,transient elevations of liver transaminase enzymes,clinical_failure,Endocrine,tox_safety,hepatotoxicity,Discontinued for safety/tox,CC[C@@H](C1=CC=CC=C1)NC(=O)C2=C(C(=NC3=CC=CC=C32)C4=CC=CC=C4)NS(=O)(=O)C,QYTBBBAHNIWFOD-NRFANRHFSA-N,23649245,OK,2017.0,78,"This molecule represents an archaic 'brute force' approach to CNS medicinal chemistry. While the TPSA (~90 Å²) and HBD count are within limits for brain penetration, the molecule suffers from severe 'Molecular Obesity'. The replacement of a likely polar group on the quinoline core with a methanesulfonamide pushes the MW over 450 Da and maintains a punishing cLogP (> 5.0). This results in poor Lipophilic Efficiency (LipE). The high aromatic ring count (4 rings) creates a significant risk of 'Brick Dust' insolubility and CYP induction via PXR activation. The benzylic amide linkage is a metabolic soft spot, and the overall lipophilic load triggers the 'Rule of Two' for DILI risk. It looks like a compound that solves potency through hydrophobic collapse rather than specific binding interactions.",Low,"High lipophilic burden (DILI risk), Benzylic amine (metabolic instability), Quinoline core (potential for CYP induction/PXR activation).",0.6,"Formulation will be a nightmare due to poor aqueous solubility. Safety risks are moderate, but PK variability is likely.",0.15,High risk of failure due to poor efficacy-to-safety margins. The 'Grease Tax' suggests high protein binding and low free fraction in the brain.,0.05,Chronic dosing likely to reveal liver enzyme induction or hepatotoxicity signals common to this chemotype.,0.0045
balapiravir,,HCV nucleoside prodrug (NS5B polymerase inhibitor class),HCV NS5B RNA-dependent RNA polymerase,Hepatitis C,Phase 2,,2011,Lymphopenia / hematologic toxicity reported in trials,clinical_failure,Infectious,tox_safety,hematologic_toxicity,Discontinued for safety/tox,CC(C)C(=O)OC[C@@]1([C@H]([C@H]([C@@H](O1)N2C=CC(=NC2=O)N)OC(=O)C(C)C)OC(=O)C(C)C)N=[N+]=[N-],VKXWOLCNTHXCLF-DXEZIKHYSA-N,11691726,OK,2011.0,78,"This molecule is a 'Tri-ester Grenade'—a bloated prodrug (MW > 500) designed to force a polar, toxicophore-bearing payload (4'-azido nucleoside) across biological membranes. While the heavy 'greasing' with isobutyrate esters solves the permeability issue of the parent, it pushes the molecule into 'Brick' territory (MW > 500, High HBA), violating fundamental developability rules. The core warhead contains an aliphatic azide attached to the 4'-position; this is a severe structural alert for genotoxicity (Ames liability) and mitochondrial DNA polymerase inhibition (Pol γ), a mechanism historically linked to fatal lactic acidosis and bone marrow failure in this class. The strategy relies entirely on rapid, uniform de-esterification, introducing significant pharmacokinetic variability. Tox Summary: Not Clean (Mitochondrial toxicity, Genotoxicity, Hematotoxicity risks).",Low,"Aliphatic Azide (Genotox/Explosive potential), Cytidine mimetic (Myelosuppression), High Ester Load (Acidosis risk)",0.45,High risk of early safety signals (hematology/GI) and potential Ames positivity due to the azide moiety. MW > 500 complicates formulation.,0.2,Efficacy requires precise intracellular phosphorylation of the parent. High attrition risk due to narrow therapeutic window (Mitochondrial toxicity vs. Viral potency).,0.05,"Chronic toxicity (peripheral neuropathy, lipodystrophy, or bone marrow suppression) typical of nucleoside analogs often emerges here, leading to withdrawal.",0.15
GLPG-1690,,Autotaxin inhibitor,Autotaxin (ENPP2),Idiopathic pulmonary fibrosis,Phase 3,,2021,Safety signal prompted termination of Phase III,clinical_failure,Respiratory,tox_safety,risk_benefit_unfavorable,Discontinued for safety/tox,CCC1=C(N2C=C(C=C(C2=N1)C)N3CCN(CC3)CC(=O)N4CC(C4)O)N(C)C5=NC(=C(S5)C#N)C6=CC=C(C=C6)F,REQQVBGILUTQNN-UHFFFAOYSA-N,90420193,OK,2021.0,35,"This molecule is a highly engineered kinase inhibitor (likely targeting JAK/SYK/BTK) featuring a fused pyrrolo-triazine core, a thiazole-nitrile head, and a solubilizing azetidin-3-ol tail. The physicochemical profile is mixed: MW is high (~555 Da), pushing the 'Brick' boundary, and TPSA (~127) suggests poor CNS penetration but acceptable peripheral exposure. However, the LipE appears optimized with a cLogP in the 2-3 range, balanced by the polar tail. The use of the azetidin-3-ol moiety is a sophisticated tactic to reduce lipophilicity without adding excessive HBDs (only 1 HBD total). The 2-aminothiazole motif carries a structural alert for idiosyncratic toxicity (bioactivation potential), but the N-methylation and electron-withdrawing nitrile may mitigate this risk. The fluorophenyl group blocks metabolic soft spots. Overall, this is a potent-looking chemical probe or clinical candidate with manageable developability risks, primarily related to its high MW and potential aminothiazole liability.",Medium,"2-aminothiazole motif (potential bioactivation), Nitrile (minor risk)",0.75,"Clean hERG profile expected (no strong basic center, low pKa amines). Main risk is idiosyncratic toxicity from the aminothiazole core.",0.45,"High potency expected due to optimized scaffold. Oral bioavailability might be permeability-limited due to MW/TPSA, but solubility should be adequate.",0.2,Long-term safety depends on the specific selectivity profile (kinase promiscuity) and the metabolic fate of the thiazole ring.,0.65
GSK-2983559,,RIPK2 inhibitor,Receptor-interacting serine/threonine-protein kinase 2 (RIPK2),Inflammatory disease (studied),Phase 1,,2019,"Non-clinical toxitity (preclinical studies, narrow safety thresholds/reduced safety margins",clinical_failure,Immunology,tox_safety,risk_benefit_unfavorable,Discontinued for safety/tox,CC(C)(C)S(=O)(=O)C1=C(C=C2C(=C1)C(=NC=N2)NC3=CC4=C(C=C3)SC=N4)OCCOP(=O)(O)O,MJLYDVMFNHZMLV-UHFFFAOYSA-N,73386708,OK,2019.0,38,"This molecule is a phosphate prodrug of a quinazoline-based kinase inhibitor. The core architecture (Quinazoline-4-amine) is a 'canonical' hinge-binding scaffold, heavily traversed in medicinal chemistry, implying a high risk of IP congestion and kinome promiscuity (The 'Selectivity Tax'). The presence of the phosphate ester tail (-OCCOP(=O)(O)O) is a 'Confession of Failure' regarding the physicochemical properties of the parent alcohol; it indicates the active parent likely suffers from 'Brick-like' insolubility (high crystal lattice energy) or poor oral bioavailability (BCS Class II/IV). While the tert-butyl sulfone provides a unique, bulky, polar-neutral anchor (likely targeting a solvent-front or gatekeeper pocket), it adds significant molecular weight without contributing to LipE if not perfectly positioned. The benzothiazole moiety is a flat, lipophilic intercalator that improves potency but introduces metabolic liabilities (S-oxidation, ring opening). The strategy relies entirely on the in vivo cleavage of the phosphate; if the phosphatase activity is variable, exposure will be erratic. Tox Summary: Not Clean (Benzothiazole liability + Kinase Promiscuity).",Medium,"Benzothiazole (Bioactivation/S-oxidation risk), Quinazoline core (Kinome promiscuity/Off-target toxicity), Phosphate linker (potential for accumulation of ethylene glycol byproducts if chronic, though low risk).",0.85,"Phosphate prodrugs historically perform well in Phase 1 by masking solubility issues, ensuring linear PK and sufficient exposure for safety assessment.",0.4,The parent molecule is likely potent (high affinity scaffold). Success depends entirely on the selectivity profile of the quinazoline core against the target disease kinome.,0.25,Commercial viability is the hurdle. 'Me-too' quinazolines face a crowded market. Chronic safety of the benzothiazole metabolite and long-term off-target effects are the main attrition risks.,0.085
HT-2157,,GALR3 antagonist,Galanin receptor type 3 (GALR$_3$),Anxiety / mood disorders (studied),Phase 1/2,,2012,"Cell Toxicity, non-receptor-mediated toxicity",clinical_failure,CNS,tox_safety,non-cell-specific_toxicity,Discontinued for safety/tox,C1=CC=C(C=C1)N2C3=CC=CC=C3C(=NC4=CC=CC(=C4)C(F)(F)F)C2=O,TXCGMRVPXUBHAL-UHFFFAOYSA-N,1471834,OK,2012.0,88,"This molecule is a medicinal chemistry 'dead end'. It exhibits the classic 'Brick' profile: high lipophilicity (cLogP > 5.5) combined with a dangerously low TPSA (< 35 Å²), indicating solubility will be effectively zero. The core scaffold, a 3-iminoisoindolin-1-one, contains an exocyclic imine that is susceptible to hydrolytic cleavage, releasing the toxicophore 3-(trifluoromethyl)aniline (associated with methemoglobinemia and genotoxicity) and the parent phthalimide. Lacking any solubilizing groups or specific polar pharmacophores, its activity is likely driven by non-specific hydrophobic aggregation. It violates the 'Grease Tax' and 'Fragment Tox' rules simultaneously. Tox Summary: Not Clean.",Low,"3-(trifluoromethyl)aniline (via hydrolysis), N-phenyl moiety (bioactivation to quinone-imine)",0.1,High risk of clinical hold due to toxic metabolite release (aniline) and inability to formulate for adequate exposure.,0.05,Likely to fail due to lack of efficacy (non-specific binding) or idiosyncratic toxicity in expanded cohorts.,0.01,Chronic safety signals related to aniline accumulation would likely preclude approval.,0.01
KRP-297,,Dual PPARa/y agonist,Peroxisome proliferator-activated receptors _ and _,Type 2 diabetes / metabolic disease,Phase 2,,2004,hemangiosarcoma,clinical_failure,Metabolic,tox_safety,tumorigenecity_toxicity,Discontinued for safety/tox,COC1=C(C=C(C=C1)CC2C(=O)NC(=O)S2)C(=O)NCC3=CC=C(C=C3)C(F)(F)F,NFFXEUUOMTXWCX-UHFFFAOYSA-N,151183,OK,2004.0,68,"The molecule is a classic 'Me-Too' PPAR-gamma agonist utilizing the 2,4-thiazolidinedione (TZD) headgroup. While the TZD moiety provides a reliable anionic anchor (pKa ~6.8) that effectively eliminates hERG liability, it carries significant historical baggage regarding fluid retention, weight gain, and idiosyncratic hepatotoxicity. The physicochemical profile is mediocre: the molecule relies on a 'Grease Sandwich' architecture—a lipophilic trifluoromethyl-benzyl tail and a central phenyl ring flanking the polar headgroup. With an estimated cLogP > 4.0 and MW ~450, the Lipophilic Efficiency (LipE) is likely suboptimal. The ortho-methoxy benzamide motif provides good conformational locking via intramolecular hydrogen bonding, but this does not outweigh the systemic safety risks associated with the TZD class in a modern discovery setting. This is 1990s medicinal chemistry. Tox Summary: Not Clean (TZD Class Effects/DILI Risk).",Medium,"Thiazolidinedione ring (Class Alert for Hepatotox/Edema), Benzylic methylene (Oxidation prone), Trifluoromethyl (Lipophilicity driver)",0.75,"TZD toxicity is often idiosyncratic or chronic (fluid retention), allowing for a likely pass in single-ascending dose studies. Anionic character protects against acute hERG channel block.",0.55,"Mechanism of action (PPARg) is validated for glucose lowering, suggesting high probability of efficacy, provided the linker geometry fits the receptor.",0.1,"The commercial viability of new TZDs is near zero due to the stringent safety hurdles (CV risk, bladder cancer, bone fracture) established by predecessors like Rosiglitazone.",0.04
lidorestat,,Aldose reductase inhibitor,Aldose reductase,Diabetic complications (studied),Phase 1/2,,2003,Liver toxicity,clinical_failure,Cardiovascular,tox_safety,hepatotoxicity,Discontinued for safety/tox,C1=CC=C2C(=C1)C(=CN2CC(=O)O)CC3=NC4=C(C(=CC(=C4S3)F)F)F,KYHVTMFADJNSGS-UHFFFAOYSA-N,157839,OK,2003.0,45,"The molecule presents as a classic 'Lipophilic Acid' chemotype (cLogP ~3.8-4.2 + Carboxylic Acid). While the MW (<400) and rigid heteroaromatic cores suggest good potency and permeability, this specific physicochemical profile is a frequent driver of idiosyncratic drug-induced liver injury (DILI). The primary clearance mechanism will almost certainly be glucuronidation of the N-linked acetic acid; if the resulting acyl glucuronide is reactive (common with aryl/heteroaryl acetic acids), it poses a haptenization risk. The trifluoro-benzothiazole tail is a 'grease anchor'—it blocks metabolic soft spots effectively but relies heavily on hydrophobic collapse for affinity, potentially sacrificing LipE. The unsubstituted C2 position on the indole is a secondary oxidative liability. While not a 'Hard Kill', the combination of high lipophilicity and a carboxylic acid warhead requires a low daily dose (<10mg) to be safe, which is difficult to achieve with this scaffold. Tox Summary: Not Clean (Acyl Glucuronide/DILI Risk).",Medium,"Carboxylic acid (Acyl Glucuronide formation), Unsubstituted Indole C2 (Oxidative polymerization risk)",0.85,Molecule lacks acute hERG pharmacophores (anionic at pH 7.4) and overt suicide inhibitors. Likely to pass acute safety.,0.3,High risk of attrition due to 'transaminase noise' (liver signals) common to lipophilic acids. Efficacy must be potent enough to keep dose low.,0.1,Chronic dosing of lipophilic acids often reveals rare idiosyncratic toxicity. Commercial viability is low unless best-in-class potency is achieved.,0.55
MK-0893,,Glucagon receptor (GCGR) antagonist,Glucagon receptor (GCGR),Type 2 diabetes,Phase 2,,2016,dose-dependent increases in liver enzymes (ALT) and LDL-cholesterol,clinical_failure,Metabolic,tox_safety,hepatotoxicity,Discontinued for safety/tox,C[C@@H](C1=CC=C(C=C1)C(=O)NCCC(=O)O)N2C(=CC(=N2)C3=CC(=CC(=C3)Cl)Cl)C4=CC5=C(C=C4)C=C(C=C5)OC,DNTVJEMGHBIUMW-IBGZPJMESA-N,11570626,OK,2016.0,72,"This molecule exhibits classic signs of 'Molecular Obesity' (MW > 550, high aromatic ring count). While the carboxylic acid tail attempts to rescue the physicochemical profile by lowering LogD7.4 and mitigating hERG risk (via anionic repulsion), the core scaffold is a massive lipophilic slab. The combination of a central imidazole ring flanked by a dichlorophenyl group and a methoxynaphthalene moiety creates a textbook pharmacophore for CYP inhibition (Type II binding to heme iron + hydrophobic pocket occupancy), creating significant Drug-Drug Interaction (DDI) liability. Furthermore, the high intrinsic lipophilicity (cLogP > 5 for the neutral species) combined with the high molecular weight triggers the 'Rule of Two' alert for Drug-Induced Liver Injury (DILI), suggesting that high doses would likely result in hepatotoxicity or transporter inhibition (e.g., BSEP). The beta-alanine linker suggests a target requiring a specific acidic interaction (likely Class B GPCR), but the 'Grease Tax' paid to achieve affinity here is too high for a sustainable chronic drug profile. Tox Summary: Not Clean (DILI/CYP risks).",Low,"Imidazole core (CYP Inhibition), 2-Methoxynaphthalene (Bioactivation/Quinone risk), 3,4-Dichlorophenyl (Lipophilicity burden)",0.45,"High risk of variable pharmacokinetics and CYP-mediated DDI. Phase 1 safety might pass single ascending dose, but multiple ascending dose could reveal enzyme induction or inhibition.",0.2,"Efficacy might be achievable, but the therapeutic window will likely be closed by off-target toxicity (liver enzymes) or lipid abnormalities common to lipophilic acids of this size.",0.05,Commercial viability is low due to the competitive landscape requiring cleaner safety profiles. The DILI risk is a likely attrition factor in large populations.,0.25
MMV-390048,,PI4K inhibitor (antimalarial),Phosphatidylinositol 4-kinase (PI4K),Malaria,Phase 1/2,,2020,"adverse developmental toxicity (teratogenicity), specifically diaphragmatic hernias and cardiovascular malformations",clinical_failure,Infectious,tox_safety,developmental_toxicity,Discontinued for safety/tox,CS(=O)(=O)C1=CC=C(C=C1)C2=CC(=C(N=C2)N)C3=CN=C(C=C3)C(F)(F)F,RTJQABCNNLMCJF-UHFFFAOYSA-N,53311393,OK,2020.0,18,"This molecule represents a textbook example of 'Elite' medicinal chemistry optimization. It features a rigid, low-molecular-weight (<400 Da) tri-aryl scaffold that maximizes binding enthalpy while minimizing entropic penalties. The physicochemical profile is nearly ideal: the lipophilicity of the trifluoromethyl and aryl rings is perfectly counterbalanced by the polarity of the methylsulfone and the aminopyridine core, likely landing the cLogP in the 'Goldilocks' zone (2.0-3.0). The use of a sulfone rather than a sulfonamide avoids potential hypersensitivity issues while maintaining hydrogen bond acceptor capability. The trifluoromethyl group serves as a metabolic block on the distal ring, forcing metabolism to the central core or the unsubstituted phenyl positions. The primary developability risk is 'Brick Dust' behavior—high crystallinity and high melting point due to the planar, rigid structure—which could limit dissolution-driven absorption. However, the high heteroatom count (sulfone, amino, pyridine nitrogens) provides sufficient polarity to mitigate this. There are no obvious 'Hard Kill' toxicophores.",High,None identified (Clean). 2-aminopyridine moiety is generally safe but requires standard genotoxicity screening.,0.85,"Chemically stable, achiral (CMC dream), and lacks reactive metabolites. High probability of passing safety pharmacology.",0.6,"High potency is expected due to the rigid scaffold. Efficacy depends on the validity of the target, but the molecule itself is 'drug-like' enough to test the hypothesis thoroughly.",0.4,"Commercial viability is the main hurdle. If this is a COX-2 inhibitor (suggested by the pharmacophore), cardiovascular safety signals (class effect) could derail it in large populations.",0.92
nesbuvir,,HCV NS5B polymerase inhibitor (non-nucleoside),HCV NS5B RNA-dependent RNA polymerase (Non-nucleoside),Hepatitis C,Phase 2,,2011,did not demonstrate enough potency,clinical_failure,Infectious,efficacy,efficacy_failure,Discontinued for efficacy,CNC(=O)C1=C(OC2=CC(=C(C=C21)C3CC3)N(CCO)S(=O)(=O)C)C4=CC=C(C=C4)F,WTDWVLJJJOTABN-UHFFFAOYSA-N,11561383,OK,2011.0,24,"This molecule exhibits a highly optimized 'Drug-Like' profile with a cLogP (~3.0) and MW (~450) falling squarely in the 'Goldilocks' zone for oral bioavailability. The scaffold is a fully substituted benzofuran, where the 2,3-substitution pattern effectively blocks the most reactive sites on the furan ring, mitigating the bioactivation risks typically associated with this heterocycle. The inclusion of the N-(2-hydroxyethyl)sulfonamide moiety is a sophisticated medicinal chemistry tactic: it introduces necessary polarity (TPSA ~110 Å²) to counterbalance the lipophilic biaryl core without introducing basic amines, thereby eliminating hERG liability. However, the primary alcohol (-CH2CH2OH) represents a distinct metabolic 'soft spot' susceptible to rapid oxidation (to carboxylic acid) or glucuronidation, which will likely dictate the clearance profile. While the TPSA precludes significant CNS penetration, the physicochemical properties are ideal for a peripheral target. Tox Summary: Clean.",Medium,"None identified (Primary alcohol is a clearance liability, not a toxophore)",0.88,Clean structural alerts. No hERG pharmacophore (neutral molecule). No Michael acceptors or genotoxic anilines. High safety probability.,0.45,"Excellent physicochemical properties suggest good oral exposure. Efficacy depends on target validation, but the molecule is clearly an optimized lead.",0.25,Main risk is commercial differentiation and potential high clearance due to the alcohol handle requiring frequent dosing.,0.52
