compound,Alias,target_class,specific_target,indication,max_phase,year-approved,year_stopped,primary_safety_signal,category,therapeutic_area,failure_type,MedChem_Descriptor_Tag,Outcome_Granularity,isomeric,inchikey,cid,status,year_clean,Edward Score V20,Rationale V20,metabolic_stability_estimate,potential_toxic_fragments,P1 Prob V20,P1 Rationale V20,P2 Prob V20,P2 Rationale V20,P3 Prob V20,P3 Rationale V20,TCSP V20
Pexacerfont,,CRF1 antagonist,Corticotropin-releasing factor receptor 1 (CRF$_1$),Depression,Phase 2/3,,2010,Liver abnormalities,clinical_failure,CNS,efficacy,efficacy_failure,Discontinued for efficacy,CC[C@@H](C)NC1=NC(=NC2=C(C(=NN21)C)C3=C(N=C(C=C3)OC)C)C,LBWQSAZEYIZZCE-SNVBAGLBSA-N,9884366,OK,2010.0,35,"The molecule is a pyrazolo[1,5-a]pyrimidine derivative, likely a CRF1 antagonist or similar GPCR/Kinase modulator. 

**Physicochemical Analysis:**
1.  **MW**: ~353 Da. This is excellent, well below the 450 Da limit, providing significant 'developability credit'.
2.  **cLogP**: The structure contains a fused aromatic core, a methoxy-methyl-pyridine, and a sec-butyl amine. Estimated cLogP is likely in the range of 2.5 - 3.5. This is the 'Goldilocks' zone for CNS penetration and oral bioavailability.
3.  **TPSA**: The core has 4 nitrogens (3 in the fused system, 1 exocyclic amine). The pyridine adds 1 nitrogen and 1 ether oxygen. TPSA is roughly 60-70 Å², which is ideal for brain penetration (CNS MPO).
4.  **HBD**: 1 (the secondary amine). This is perfect.

**Structural Alerts & Liabilities:**
1.  **Metabolic Stability**: The sec-butyl group is a prime site for oxidative dealkylation or hydroxylation. The methyl groups on the aromatic rings are also susceptible to benzylic oxidation. However, these are standard metabolic soft spots and not necessarily fatal.
2.  **Toxicophores**: The structure is relatively clean. It lacks obvious suicide inhibitors (furans, thiophenes) or highly reactive Michael acceptors. The hydrazine-like motif embedded in the pyrazolo-pyrimidine core is stable within the aromatic system.
3.  **hERG**: The molecule has a basic center (secondary amine) but it is directly attached to the aromatic core (aniline-like) or close to it, reducing basicity (pKa likely < 8). It lacks the classic hERG pharmacophore (basic amine + lipophilic linker + hydrophobic tail). Risk is low to moderate.
4.  **Chirality**: The (S)-sec-butyl group introduces a chiral center. This is good for potency/selectivity but requires stereoselective synthesis controls.

**Conclusion**: This is a high-quality lead-like molecule. It is small, lipophilically efficient (LipE likely > 5), and possesses properties highly compatible with CNS drug discovery. The main risk is metabolic clearance rate due to the exposed alkyl groups, but this can be optimized.",Medium,None identified (Clean),0.85,Excellent physicochemical properties and lack of structural alerts suggest a smooth path through safety pharmacology.,0.45,High LipE and CNS-friendly properties increase the probability of target engagement in the brain (if that is the target organ).,0.2,"Standard attrition rates apply, but the starting point is chemically superior to many clinical candidates.",0.85
R121919,,CRF1 antagonist,Corticotropin-releasing factor receptor 1 (CRF$_1$),Depression,Phase 2,,2006,Liver enzyme elevations,clinical_failure,CNS,tox_safety,hepatotoxicity,Discontinued for safety/tox,CCCN(CCC)C1=CC(=NC2=C(C(=NN12)C)C3=CN=C(C=C3C)N(C)C)C,ANNRUWYFVIGKHA-UHFFFAOYSA-N,9821250,OK,2006.0,72,"This molecule exhibits the classic 'Grease Trap' profile often seen in early CNS discovery. While the physicochemical properties (MW < 400, TPSA ~50, HBD=0) theoretically support BBB penetration, the reliance on the dipropylamino group for affinity is a major liability. This 'antler' motif is a notorious metabolic soft spot, guaranteeing high intrinsic clearance via N-dealkylation and omega-oxidation, likely necessitating high daily doses. Furthermore, the topology presents a textbook hERG pharmacophore: a basic center (2-dimethylaminopyridine) separated by a rigid heteroaromatic spacer from a hydrophobic cluster (dipropyl). The combination of high lipophilicity (cLogP > 4.0) and high metabolic burden flags this for significant DILI risk (Rule of Two violation). It looks like a potent binder that will fail due to poor DMPK and liver safety signals.",Low,"Dipropylamino group (High Clearance/Metabolic instability), 2-dimethylaminopyridine (hERG basic center), Electron-rich heteroaromatic core (potential for reactive metabolite formation post-dealkylation).",0.6,"Manageable acute toxicity, though hERG signals may require careful dose escalation. High lipophilicity may cause formulation challenges.",0.25,High risk of failure due to 'pharmacokinetic failure' (short half-life) or early transaminase elevations (DILI signal) resulting from the high metabolic throughput required.,0.1,"Chronic dosing of a lipophilic, high-clearance amine is a recipe for idiosyncratic liver toxicity and phospholipidosis. Commercial viability is low.",0.015
Traxoprodil,"Traxoprodil (CP-101,606)",NMDA NR2B antagonist,NMDA receptor GluN2B (NR2B) subunit,Neuropsychiatric,Phase 2,,2010,QT liability,clinical_failure,CNS,tox_safety,cardiotoxicity,Discontinued for safety/tox,C[C@@H]([C@H](C1=CC=C(C=C1)O)O)N2CCC(CC2)(C3=CC=CC=C3)O,QEMSVZNTSXPFJA-HNAYVOBHSA-N,219101,OK,2010.0,62,"This molecule presents a classic 'Privileged Scaffold Trap'. The 4-hydroxy-4-phenylpiperidine moiety is a known pharmacophore for various CNS targets (NMDA, Opioid, Sigma), guaranteeing potency, but it carries significant liabilities. 

1. **The hERG Pharmacophore**: The combination of a basic piperidine nitrogen, a lipophilic central core, and a distal aromatic ring (the phenol) separated by a flexible linker is a textbook alert for hERG channel blockade (QTc prolongation risk). 

2. **Metabolic Liability**: The exposed phenol is a 'Phase II Sponge'. It will undergo rapid glucuronidation and sulfation, leading to high first-pass clearance and poor oral bioavailability. The secondary alcohol in the linker adds another conjugation site. 

3. **CNS Penetration**: While the MW (327) and cLogP (~2.0) are ideal, the Hydrogen Bond Donor (HBD) count is 3. For CNS drugs, HBD > 2 often restricts blood-brain barrier permeability via P-gp efflux, unless an active transport mechanism is involved. 

4. **Bioactivation**: While not a suicide inhibitor, the phenol can be metabolically activated to quinone methides or radical species, though the para-substitution mitigates this slightly. 

Conclusion: A potent binder in vitro that likely suffers from 'high clearance, short half-life' and 'cardiac safety margins' in vivo. Tox Summary: Not Clean (hERG/Phase II dominant).",Low,"Exposed Phenol (Phase II sponge/Quinone risk), Basic Piperidine linked to aromatics (hERG liability)",0.55,High risk of QTc prolongation and potentially poor PK (high variability due to first-pass metabolism) may halt progression.,0.3,"Efficacy may be hampered by poor CNS exposure (HBD count) and short half-life requiring frequent dosing, which exacerbates Cmax-driven side effects.",0.1,Commercial viability is low. Cleaner competitors with better oral bioavailability and no cardiac signal would dominate.,0.35
AMG-517,,TRPV1 antagonist,Transient receptor potential vanilloid 1 (TRPV1),Pain,Phase 1,,2007,Hyperthermia; also poor solubility/biopharm constraints,clinical_failure,CNS,tox_safety,other_safety_or_unknown,Discontinued for safety/tox,CC(=O)NC1=NC2=C(C=CC=C2S1)OC3=NC=NC(=C3)C4=CC=C(C=C4)C(F)(F)F,YUTIXVXZQIQWGY-UHFFFAOYSA-N,16007367,OK,2007.0,72,"The molecule is a classic 'Kinase Greaseball'—a flat, lipophilic aromatic stack (Fsp3 ~ 0.05) driven by hydrophobic interactions rather than specific polar contacts. With a cLogP pushing >4.5 and a 'Brick Dust' structural profile, solubility will be the primary developability killer (BCS Class II/IV). Structurally, the N-acetyl-2-aminobenzothiazole motif is a 'Masked Aniline' alert; metabolic deacetylation in vivo (common in rodents) releases the free 2-aminobenzothiazole, a scaffold historically plagued by Ames positivity and bioactivation liabilities (sulfotransferase-mediated nitrenium ion formation). While the TPSA (<90) and MW (<450) suggest CNS potential, the lack of sp3 complexity and high lipophilicity guarantees promiscuity and poor free-fraction exposure. Tox Summary: Not Clean.",Medium,"2-aminobenzothiazole (latent genotox), Trifluoromethylphenyl (lipophilicity/retention), Pyrimidine (kinome promiscuity)",0.4,High risk of genotoxicity signal from the benzothiazole core; solubility issues may complicate formulation and exposure linearity.,0.3,Efficacy will struggle against poor physicochemical properties; high protein binding and rapid clearance of the deacetylated metabolite will limit therapeutic index.,0.1,Chronic safety risks (off-target kinase hits + reactive metabolites) usually sink these 'flat' inhibitors in late-stage trials.,0.012
MCC950,,NLRP3 inhibitor,NLRP3 inflammasome,Inflammatory disease,Phase 2,,2020,Hepatotoxicity,clinical_failure,Immunology,tox_safety,hepatotoxicity,Discontinued for safety/tox,CC(C)(C1=COC(=C1)S(=O)(=O)NC(=O)NC2=C3CCCC3=CC4=C2CCC4)O,HUUSXLKCTQDPGL-UHFFFAOYSA-N,9910393,OK,2020.0,72,"This molecule presents a deceptive 'Jekyll and Hyde' profile. While the physicochemical properties are theoretically elite (MW ~404, cLogP ~2.5, TPSA ~110), placing it firmly in the oral bioavailability 'Goldilocks' zone, the structure contains a fatal flaw. The Furan ring is a 'Hard Kill' structural alert for Mechanism-Based Inhibition (MBI) of CYP450s. Despite the electron-withdrawing sulfonyl group potentially dampening reactivity, furans are notorious for bioactivation to toxic cis-butene-1,4-dial intermediates, driving idiosyncratic hepatotoxicity (DILI). The tricyclic hydrocarbon tail (hexahydro-s-indacene type) acts as a 'grease anchor' that will drive potency but suffers from multiple sites for benzylic oxidation, limiting metabolic stability. The tertiary alcohol is a smart LipE modulator, but it cannot redeem the fundamental toxicity risk of the furan core. Tox Summary: Not Clean.",Low,"Furan ring (MBI/Bioactivation), Sulfonylurea moiety (Hypoglycemia risk/Sulfa allergy)",0.2,Probability capped at 20% due to the presence of a 'Hard Kill' moiety (Furan). High risk of failure in GLP toxicology due to reactive metabolites.,0.4,"If acute toxicity is manageable, the excellent physicochemical properties suggest good tissue distribution and target engagement.",0.05,"Probability capped at 5%. Even if early development succeeds, furan-containing drugs carry a high liability for late-stage attrition due to idiosyncratic DILI in broader populations.",0.004
Zelnecirnon,Zelnecirnon (RPT193),CCR4 antagonist,C-C chemokine receptor type 4 (CCR4),Inflammatory disease,Phase 2,,2024,Severe liver injury,clinical_failure,Immunology,tox_safety,hepatotoxicity,Discontinued for safety/tox,CC1=C(C(=NC(=N1)N2CC(C2)[C@H]3CCCN(C3)C4CC(C4)(C)C(=O)O)N[C@H](C)C5=C(C=C(C=C5)Cl)Cl)Cl,ANPSFQZLPNWKHR-PRZTZBHNSA-N,139344142,OK,2024.0,38,"This molecule represents a highly engineered 'Smart Brick' (MW > 500) designed to navigate the 'Beyond Rule of 5' space. The scaffold features a 2,4-diamino-5-methyl-6-chloropyrimidine core, which is electronically deactivated by the amino groups, mitigating the risk of nucleophilic aromatic substitution (SnAr) on the chlorine. The zwitterionic nature (basic pyrrolidine/azetidine system + carboxylic acid) is a classic medicinal chemistry tactic to eliminate hERG liability by reducing channel affinity, though it introduces permeability challenges. The carboxylic acid is strategically placed on a gem-disubstituted cyclopropane ring (quaternary center), providing significant steric hindrance to prevent the formation of reactive acyl glucuronides (DILI risk mitigation). The 2,4-dichloroaniline moiety is N-alkylated and metabolically blocked, reducing bioactivation risks. While the high molecular weight and structural complexity (multiple chiral centers, spiro/fused systems) impose a 'Synthesis Tax' and potential oral bioavailability hurdles, the design explicitly addresses major toxicity flaws found in simpler analogs. Tox Summary: Clean, with developability risks centered on permeability and COGS.",High,"Chloro-pyrimidine (Mitigated by electron-rich ring), Dichloroaniline moiety (Stable), Cyclopropyl-carboxylic acid (Mitigated by steric hindrance)",0.85,"Strong safety design. Zwitterion negates hERG; hindered acid negates DILI. Primary risk is PK (exposure), not Tox.",0.45,Efficacy will depend on whether the zwitterionic properties allow sufficient intracellular concentration or CNS penetration (if applicable).,0.25,Commercial viability limited by synthetic complexity (COGS) and potential for chronic toxicity related to the poly-pharmacology of heavy kinase/phosphatase inhibitors.,0.42
AB-506,,HBV capsid inhibitor,Hepatitis B virus (HBV) core protein,Hepatitis B,Phase 1,,2019,ALT flares/liver injury,clinical_failure,Infectious,tox_safety,hepatotoxicity,Discontinued for safety/tox,CN1C=NC(=N1)COC(=O)N[C@H]2CCC3=C(C=CC(=C23)F)C(=O)NC4=CC(=C(C=C4)F)Cl,DMJDVZSGLNPLSS-KRWDZBQOSA-N,142433688,OK,2019.0,35,"This molecule is a textbook example of 'S1-S4' protease inhibitor design, likely targeting a serine protease (Factor Xa/Thrombin profile). While the pharmacophore is well-defined, the physicochemical profile is concerningly 'neutral and heavy'. 

1. **Solubility Desert**: The molecule lacks a distinct ionizable center (pKa > 7) to assist with aqueous solubility. The triazole is weakly basic, and the core is highly lipophilic (Tetralin + Halo-Phenyl). With MW approaching 475 and a rigid, planar aromatic character, this structure screams 'Dissolution-Limited Absorption' (DCS Class II). Expect high crystal lattice energy and formulation headaches.

2. **Metabolic Soft Spots**: The tetralin core is a metabolic sponge. The benzylic methylene groups are prime targets for CYP3A4-mediated hydroxylation. Additionally, the carbamate linker, while generally stable, adds a hydrolysis liability compared to an all-amide scaffold.

3. **Structural Alerts**: The 3-chloro-4-fluoroaniline moiety is an electron-deficient aniline. While the halogens reduce the risk of N-oxidation compared to electron-rich anilines, it remains a structural alert for idiosyncratic toxicity (DILI) if the dose is high—which it might need to be given the predicted poor solubility.

4. **Efficiency**: The molecule relies on 'grease' (lipophilicity) and neutral H-bonds for affinity. It lacks the high LipE usually seen in elite leads (Score < 20). It is a competent drug candidate, but not an elegant one. Tox Summary: Clean, but watch the aniline.",Medium,"3-chloro-4-fluoroaniline moiety (potential reactive metabolite risk), Benzylic carbons on tetralin (metabolic hotspot)",0.85,Standard drug-like properties. No 'Hard Kill' signals like nitro groups or Michael acceptors. hERG risk is low due to lack of basic amine.,0.45,"Efficacy is likely high, but PK variability (due to solubility/metabolism) could lead to wide exposure ranges, complicating the therapeutic window (bleeding vs clotting risk).",0.2,Commercial viability is threatened by the 'neutral/insoluble' nature compared to competitors. Safety profile in chronic dosing (DILI) is the main attrition risk.,0.076
Taranabant,,CB1 inverse agonist,Cannabinoid receptor 1 (CB1),Obesity,Phase 3,,2008,Psychiatric adverse effects,clinical_failure,Metabolic,tox_safety,neurotoxicity,Discontinued for safety/tox,C[C@@H]([C@@H](CC1=CC=C(C=C1)Cl)C2=CC=CC(=C2)C#N)NC(=O)C(C)(C)OC3=NC=C(C=C3)C(F)(F)F,QLYKJCMUNUWAGO-GAJHUEQPSA-N,11226090,OK,2008.0,75,"This molecule is a textbook example of the 'Grease Tax' violation. While it lacks obvious reactive toxicophores and incorporates intelligent metabolic blocking strategies (gem-dimethyl, fluorination, para-chlorine), the physicochemical profile is extremely poor. With a Molecular Weight > 500 and an estimated cLogP > 5.5, the molecule classifies as a 'Brick' (High MW, Low TPSA). This profile predicts high non-specific binding, poor aqueous solubility, and a significant risk of phospholipidosis and DILI (Rule of Two: High LogP + High Dose/Complexity). While the TPSA (< 90) suggests CNS penetration, the high lipophilicity implies the drug will partition into all lipid membranes, eroding the therapeutic index. Potency is likely driven by non-specific hydrophobic interactions rather than precise enthalpic binding. Tox Summary: Structurally Clean, Physicochemically Dirty.",High,None (High Lipophilicity is the main hazard),0.7,"Chemical stability is high and metabolic soft spots are blocked. Likely to pass acute safety, though PK variability due to solubility may be an issue.",0.3,High risk of attrition due to poor free fraction (high protein binding) and potential off-target effects driven by lipophilicity.,0.1,"Chronic dosing of 'Bricks' often reveals safety signals (liver, CNS, accumulation) that are not apparent in short-term studies.",0.021
Otenabant,,CB1 antagonist,Cannabinoid receptor 1 (CB1),Obesity,Phase 2,,2009,CNS safety concern,clinical_failure,Metabolic,tox_safety,neurotoxicity,Discontinued for safety/tox,CCNC1(CCN(CC1)C2=NC=NC3=C2N=C(N3C4=CC=C(C=C4)Cl)C5=CC=CC=C5Cl)C(=O)N,UNAZAADNBYXMIV-UHFFFAOYSA-N,10052040,OK,2009.0,78,"This molecule is a textbook 'Molecular Brick' (MW > 500) that heavily utilizes the 'Grease Tax' to achieve potency. The core scaffold is a rigid, highly lipophilic di-aryl purine system, further burdened by two chlorine atoms which, while blocking metabolism, push the cLogP well beyond the CNS Goldilocks zone (likely > 5.0). The structural arrangement—a basic secondary amine (ethylamino) tethered to a massive hydrophobic domain via a piperidine linker—constitutes a screaming hERG pharmacophore (Red Flag). Furthermore, the combination of high lipophilicity (cLogP > 3) and a cationic center (pKa > 8) creates a high risk for Phospholipidosis (PLD) and tissue accumulation. While the quaternary carbon at the piperidine C4 provides some metabolic shielding, the N-ethyl group is a prime site for oxidative dealkylation. This is 'Brute Force' medicinal chemistry: high affinity achieved through non-specific hydrophobic interactions rather than precise molecular recognition. Tox Summary: Not Clean (High hERG liability, PLD risk, and poor physicochemical compliance).",Medium,"Secondary amine linked to lipophilic core (hERG pharmacophore), N-ethyl group (N-dealkylation liability), Di-chlorophenyl motif (Excessive Lipophilicity/Bioaccumulation).",0.45,"Safety margins will be thin. The hERG liability is the primary gatekeeper here. If the hERG IC50 is < 10uM (highly likely given the structure), the therapeutic window may close before efficacy is reached.",0.25,"While target engagement is probable due to high lipophilic potency, the poor physicochemical properties (solubility-limited absorption, high protein binding) will make PK/PD correlation erratic. CNS penetration may be compromised by P-gp efflux due to the high MW/H-bond count.",0.1,"Molecules with this 'Brick-like' profile (MW > 500, cLogP > 5) have historically high attrition rates in late-stage development due to idiosyncratic toxicity (DILI) and safety signals that emerge in larger populations.",0.11
BMS-986020,,LPA1 antagonist,Lysophosphatidic acid receptor 1 (LPA1),Idiopathic pulmonary fibrosis,Phase 2,,2018,Hepatobiliary toxicity,clinical_failure,Respiratory,tox_safety,hepatotoxicity,Discontinued for safety/tox,CC1=NOC(=C1NC(=O)O[C@H](C)C2=CC=CC=C2)C3=CC=C(C=C3)C4=CC=C(C=C4)C5(CC5)C(=O)O,GQBRZBHEPUQRPL-LJQANCHMSA-N,49792850,OK,2018.0,28,"This molecule represents a highly optimized, late-stage GPCR agonist candidate (likely S1P family), characterized by a 'Grease-Acid' architecture. The design incorporates sophisticated elements: a conformationally restricted cyclopropyl acid tail to block beta-oxidation and lock the pharmacophore, and a chiral carbamate linker to maximize selectivity. However, the molecule carries a heavy 'Grease Tax'. The intrinsic lipophilicity (neutral cLogP > 5.0) is masked solely by the carboxylic acid. While this lowers LogD7.4 to a developable range, the underlying lipophilic bulk (biphenyl + phenethyl + isoxazole) creates significant risks for high plasma protein binding (>99%), hepatic accumulation, and acyl glucuronide formation. The biphenyl moiety is a 'lazy' hydrophobic spacer that adds unnecessary MW and insolubility risk. While hERG risk is low due to the anionic headgroup, the DILI potential via reactive acyl glucuronides and transporter inhibition (OATP/MRP) is the primary liability. It is a 'Professional' molecule, but one that walks a tightrope between potency and metabolic toxicity. Tox Summary: Not Clean (Acyl Glucuronide/DILI Risk).",Medium,"Acyl Glucuronide (reactive metabolite risk), Amino-isoxazole (potential hydrolysis product), Biphenyl (CYP oxidation/PXR activation).",0.85,Low hERG risk due to acidic nature. Clean Ames profile expected. Phase 1 safety likely acceptable unless PK is non-linear due to solubility limits.,0.6,Potency is likely nanomolar (High LipE). Main risk is PK/PD disconnect due to high protein binding or poor tissue distribution (acid trapping).,0.35,Commercial viability threatened by rare idiosyncratic toxicity (DILI) associated with high-MW acidic lipophiles (Rule of Two violation).,0.75
LY3023703,,mPGES-1 inhibitor,Microsomal prostaglandin E synthase-1 (mPGES-1),Pain,Phase 1,,2018,Reactive metabolite DILI,clinical_failure,Pain,tox_safety,hepatotoxicity,Discontinued for safety/tox,CC1=C(N=C(N1)NC(=O)C2=C(N=CC(=C2)CNC(=O)C(C)C)C(F)F)C3=CC=C(C=C3)C(F)(F)F,BZYSILFNUIGABU-UHFFFAOYSA-N,71059525,OK,2018.0,28,"This is a textbook example of modern kinase inhibitor design (Type II or Type 1.5), featuring a 'hinge-binding' aminopyrazole scaffold linked to a 'solvent-front' pyridine. The medicinal chemistry is sophisticated: the use of a difluoromethyl (CHF2) group acts as a lipophilic bioisostere that modulates pKa and metabolic stability without the full 'grease' penalty of a CF3 or the metabolic liability of a methyl/methoxy. The isobutyramide tail is a classic solubilizing motif designed to disrupt crystal packing. However, the molecule carries a significant 'Grease Tax' (Estimated cLogP ~4.0-4.5, MW ~490), placing it firmly in Class II/IV of the BCS (Brick Dust risk). The unsubstituted pyrazole NH represents a specific Phase II liability (N-glucuronidation) which could limit oral bioavailability. While the tox profile appears clean, the heavy reliance on aromaticity and fluorination suggests P-gp efflux and solubility-limited absorption will be the primary development hurdles. Tox Summary: Clean.",Medium,None identified (Clean).,0.85,Clean structural alerts. No obvious hERG pharmacophore (low basicity) or reactive metabolites. High probability of passing safety.,0.45,Potency is likely high due to optimized scaffold. Main attrition risk is PK (bioavailability/clearance) due to solubility and glucuronidation.,0.2,Standard attrition for kinase inhibitors (efficacy/competition). No specific late-stage safety signals predicted.,0.0765
LY3031207,,mPGES-1 inhibitor,Microsomal prostaglandin E synthase-1 (mPGES-1),Pain,Phase 1,,2019,Phase 1 DILI,clinical_failure,Pain,tox_safety,hepatotoxicity,Discontinued for safety/tox,CC(C)(C)C(=O)NCC1=CC(=C(C=C1)Cl)C(=O)NC2=NC=CN2,MBAHGUNQNAJTLD-UHFFFAOYSA-N,57382526,OK,2019.0,24,"This molecule is a textbook example of a 'Lead-Like' to 'Drug-Like' transition candidate with elite physicochemical properties. With a Molecular Weight of ~346 Da and an estimated cLogP in the Goldilocks zone (2.5-3.5), it possesses high Lipophilic Efficiency (LipE) potential. The structure features a bis-amide scaffold: a pivalamide (providing metabolic stability via the t-butyl 'brick') and a benzamide linked to a pyrazine. The ortho-chloro substitution on the central ring is a classic medicinal chemistry tactic to induce a conformational twist, breaking planarity to improve solubility and selectivity, while also blocking a metabolic soft spot. However, the molecule is effectively neutral at physiological pH (pyrazine pKa < 1), which presents a significant developability risk regarding aqueous solubility and formulation (DCS Class II). The benzylic methylene linker is the primary site for potential P450-mediated metabolic instability (hydroxylation). Despite these minor liabilities, the absence of toxicophores, hERG pharmacophores, or reactive handles makes this a high-quality NCE. Tox Summary: Clean.",Medium,"None identified (Benzylic methylene is a metabolic soft spot, not a toxicophore).",0.85,"Excellent safety profile predicted. No structural alerts, low MW, and lack of basic/lipophilic hERG pharmacophore suggest minimal off-target toxicity.",0.45,"High permeability and good metabolic stability features suggest adequate exposure. Success depends on target validation, but the chemotype is competent.",0.2,"Clean safety profile increases late-stage survival probability, though neutral solubility issues could complicate chronic dosing formulations.",0.0765
