compound,Alias,target_class,specific_target,indication,max_phase,year-approved,year_stopped,primary_safety_signal,category,therapeutic_area,failure_type,MedChem_Descriptor_Tag,Outcome_Granularity,isomeric,inchikey,cid,status,year_clean,Edward Score V20,Rationale V20,metabolic_stability_estimate,potential_toxic_fragments,P1 Prob V20,P1 Rationale V20,P2 Prob V20,P2 Rationale V20,P3 Prob V20,P3 Rationale V20,TCSP V20
Metoprolol,,Beta-1 blocker,_1_-adrenergic receptor,Hypertension,Approved,1978,,,approved,Cardiovascular,,approved_control,Approved controls (success),CC(C)NCC(COC1=CC=C(C=C1)CCOC)O,IUBSYMUCCVWXPE-UHFFFAOYSA-N,4171,OK,1978.0,12,"This molecule is a textbook example of 'Physicochemical Hygiene'. With a MW < 270 and cLogP ~1.8, it exhibits exceptional Ligand Efficiency (LE) potential and sits perfectly within the CNS MPO 'Goldilocks Zone'. The secondary amine (pKa ~9.5) ensures high solubility and target engagement (likely ionic interaction), while the ether linkages effectively cap lipophilicity, preventing the 'Grease Tax'. Structurally, the aryloxypropanolamine core is a 'privileged scaffold' (read: promiscuous), historically associated with adrenergic and serotonergic GPCRs; this raises concerns about off-target selectivity (selectivity tax) despite the clean profile. Metabolically, the para-methoxyethyl tail is a soft spot for O-demethylation and benzylic oxidation (likely CYP2D6 driven), which may lead to variable pharmacokinetics or short half-life. The hERG risk is present due to the basic amine/aromatic pharmacophore, but the low MW and lack of a heavy lipophilic tail likely mitigate this to a manageable safety margin. Tox Summary: Clean.",Medium,None,0.85,"Excellent physicochemical properties, low lipophilicity, and absence of structural alerts suggest a clean safety profile in healthy volunteers.",0.55,High permeability and solubility suggest good target exposure. The risk lies in the promiscuity of the scaffold (efficacy vs. side effects) and metabolic clearance rates.,0.35,"If efficacy is established, the molecule's drug-like properties support chronic dosing, though IP space for such a simple scaffold would be the commercial killer.",0.16
Carvedilol,,Non-selective beta blocker,"_1_, _2_, and _1_-adrenergic receptors",Heart failure,Approved,1995,,,approved,Cardiovascular,,approved_control,Approved controls (success),COC1=CC=CC=C1OCCNCC(COC2=CC=CC3=C2C4=CC=CC=C4N3)O,OGHNVEJMJSYVRP-UHFFFAOYSA-N,2585,OK,1995.0,72,"This molecule is a textbook example of 'Privileged Structure Abuse' resulting in a 'dirty' profile. You have grafted a highly lipophilic, promiscuous carbazole scaffold onto a flexible basic amine linker. 1. **hERG Liability**: The pharmacophore (Lipophilic Head + 3-Carbon Linker + Basic Amine) is a screaming red flag for hERG channel blockade (Score > 70 triggered). 2. **Promiscuity**: The carbazole moiety is a 'master key' for kinases and GPCRs, guaranteeing off-target toxicity and selectivity issues. 3. **Metabolic Variance**: The lipophilic amine suggests high affinity for CYP2D6, predicting high inter-patient variability in PK. 4. **Grease Tax**: cLogP > 4 with a flexible chain implies affinity is driven by non-specific hydrophobic collapse rather than precise molecular recognition. This is a non-selective binder masquerading as a lead. Tox Summary: Not Clean.",Low,"Secondary aliphatic amine (hERG pharmacophore), Carbazole scaffold (Kinome/GPCR promiscuity), 2-Methoxyphenol moiety (Potential for quinone-methide formation post-demethylation)",0.4,High probability of QT prolongation (hERG) and significant inter-subject variability (CYP2D6) will complicate dose escalation.,0.3,"While likely potent due to the privileged scaffold, off-target cardiovascular or CNS effects will likely limit the therapeutic window.",0.1,"Commercial viability is minimal due to the 'dirty' safety profile compared to cleaner, more selective competitors.",0.012
Propranolol,,Non-selective beta blocker,_1_ and _2_-adrenergic receptors,Hypertension/Arrhythmia,Approved,1967,,,approved,Cardiovascular,,approved_control,Approved controls (success),CC(C)NCC(COC1=CC=CC2=CC=CC=C21)O,AQHHHDLHHXJYJD-UHFFFAOYSA-N,4946,OK,1967.0,18,"This molecule represents a canonical 'Privileged Structure' (Aryloxypropanolamine) optimized for GPCR engagement. The physicochemical profile is elite: MW ~260 and cLogP ~2.9 sit squarely in the Golden Triangle, maximizing Lipophilic Efficiency (LipE). The TPSA (~41 Å²) and basic pKa (~9.5) guarantee high permeability and significant CNS exposure (Blood-Brain Barrier penetration is a certainty). However, this efficiency comes with liabilities. The structural motif (Basic Amine + 3-carbon linker + Lipophilic Naphthalene) flirts with the hERG pharmacophore, though the low MW likely prevents potent channel blockade. The primary developability risk is pharmacokinetic: the lipophilic amine combined with the electron-rich naphthalene ring (susceptible to 4-position hydroxylation) and the secondary alcohol (glucuronidation handle) suggests rapid first-pass metabolism and high clearance (CYP2D6 substrate risk). While chemically clean, the molecule is likely a 'short-acting' agent requiring formulation work. Tox Summary: Clean.",Low,"Naphthalene moiety (potential for arene oxide intermediates, though generally manageable), Secondary aliphatic amine (N-dealkylation risk).",0.85,Chemically stable with no 'hard kill' toxophores. High solubility and permeability suggest excellent oral bioavailability. Main risk is off-target pharmacology (CNS) in early escalation.,0.65,"High potency expected due to privileged scaffold. Efficacy is likely, provided the short half-life doesn't limit target coverage.",0.45,Commercial viability depends on differentiation. The high CNS penetration is a double-edged sword (efficacy vs. side effects).,0.88
Atorvastatin,,HMG-CoA reductase inhibitor,HMG-CoA reductase,Dyslipidemia,Approved,1996,,,approved,Cardiovascular,,approved_control,Approved controls (success),CC(C)C1=C(C(=C(N1CC[C@H](C[C@H](CC(=O)O)O)O)C2=CC=C(C=C2)F)C3=CC=CC=C3)C(=O)NC4=CC=CC=C4,XUKUURHRXDUEBC-KAYWLYCHSA-N,60823,OK,1996.0,58,"This molecule exhibits severe 'Molecular Obesity'. With a MW > 550 and estimated cLogP > 5.0, it sits deep in the 'Grease Tax' penalty zone. The scaffold is a hydrophobic slab (pyrrole core decorated with three aromatic rings and an isopropyl group) designed to maximize van der Waals contacts, but this brute-force potency comes at the cost of poor Lipophilic Efficiency (LipE). The N-phenyl amide moiety is a structural alert; while amides are generally stable, this specific anilide linkage raises concerns for idiosyncratic toxicity via hydrolysis to an aniline or quinone-imine formation. Furthermore, the long, flexible dihydroxy-acid side chain pushes the Rotatable Bond count > 10 ('The Balloon'), introducing a massive entropic penalty that must be overcome by binding enthalpy. While the carboxylic acid likely facilitates hepatic uptake (OATP targeting), the combination of high lipophilicity and high complexity flags this as a significant DILI risk (Rule of Two). Tox Summary: Not Clean (DILI/Anilide risk).",Low,"N-phenyl amide (Anilide alert), High Lipophilic Burden (cLogP > 5), 4-Fluorophenyl (metabolic block attempt)",0.75,"No basic amine reduces hERG risk, but high lipophilicity suggests high plasma protein binding and potential safety signals.",0.4,"Potency will be high due to hydrophobic collapse, but ADME will be the killer. Bioavailability likely limited by first-pass metabolism.",0.2,Chronic safety is the bottleneck. The high lipophilic load combined with the anilide motif creates a high probability of liver enzyme elevations (DILI).,0.06
Simvastatin,,HMG-CoA reductase inhibitor,HMG-CoA reductase,Dyslipidemia,Approved,1991,,,approved,Cardiovascular,,approved_control,Approved controls (success),CCC(C)(C)C(=O)O[C@H]1C[C@H](C=C2[C@H]1[C@H]([C@H](C=C2)C)CC[C@@H]3C[C@H](CC(=O)O3)O)C,RYMZZMVNJRMUDD-HGQWONQESA-N,54454,OK,1991.0,32,"This molecule is a classic example of 'Natural Product Grease'. While the high fraction of sp3 carbons (Fsp3) and dense stereochemistry suggest high target specificity (likely nanomolar potency), the physicochemical profile is archaic. The cLogP hovers dangerously close to 4.7, triggering a significant 'Grease Tax'. You are relying on a prodrug strategy: the cyclic lactone and the sterically hindered 2,2-dimethylbutyrate ester mask the polarity, but this creates a solubility nightmare (Brick Dust) in the gut lumen prior to hydrolysis. The lack of a basic amine precludes standard salt formation. Metabolic stability will be poor; the hexahydronaphthalene core is a prime lunch for CYP3A4 (allylic/benzylic oxidation), and the ester/lactone motifs invite esterase cleavage. While hERG risk is low (no basic center), the combination of high lipophilicity and likely high hepatic exposure flags a 'Rule of Two' DILI warning. It is a developable drug, but one that requires significant formulation heavy-lifting. Tox Summary: Clean of mutagenic alerts, but DILI risk is elevated.",Low,"Lactone moiety (potential electrophile/assay interference), High cLogP (DILI risk factor).",0.85,"High probability of passing Phase 1 safety. No hERG pharmacophore (no basic nitrogen), no suicide inhibitors (furans/acetylenes). Main risk is hepatotoxicity at high doses.",0.45,Moderate probability. The prodrug mechanism complicates PK/PD modeling. Efficacy depends entirely on the hydrolysis rate of the lactone to the active hydroxy-acid species in the target tissue.,0.2,"Commercial viability is threatened by the 'Grease Tax'. High lipophilicity often correlates with off-target toxicity in chronic dosing (DILI, myopathy).",0.18
Metformin,,Biguanide,Mitochondrial respiratory-chain complex I and AMPK,T2D,Approved,1995,,,approved,Metabolic,,approved_control,Approved controls (success),CN(C)C(=N)N=C(N)N,XZWYZXLIPXDOLR-UHFFFAOYSA-N,4091,OK,1995.0,55,"This molecule is a physicochemical outlier that violates standard drug-likeness rules due to extreme polarity. With a MW < 130 and negative cLogP, it possesses zero passive membrane permeability, forcing reliance on Solute Carrier transporters (e.g., OCTs) for bioavailability—a massive developability gamble for an NCE. The structure is a Biguanide, a class carrying a specific structural alert for Mitochondrial Complex I inhibition, which translates to a clinical risk of lactic acidosis. Additionally, the N,N-dimethyl terminus presents a manufacturing and degradation liability for the formation of secondary amines (dimethylamine), which are precursors to mutagenic nitrosamines (NDMA). While it avoids the 'Grease Tax' and is likely metabolically inert (renal clearance), the probable low potency (requiring gram-level dosing) and specific toxicity risks degrade its score. Tox Summary: Not Clean (Mitochondrial liability & Nitrosamine precursor).",High,"Biguanide core (Mitochondrial Complex I inhibition), N,N-dimethylamine moiety (NDMA precursor risk)",0.75,"Acute safety likely acceptable due to rapid renal clearance, but dose-limiting GI intolerance and acidosis risk in compromised subjects are concerns.",0.3,"Efficacy is contingent on active transport into target tissues; without specific transporter engagement, this molecule is a dud.",0.2,Chronic safety is threatened by potential mitochondrial toxicity accumulation and nitrosamine impurity risks in long-term manufacturing.,0.45
Repaglinide,,Meglitinide,ATP-sensitive potassium (K-ATP channels on pancreatic beta cells,T2D,Approved,1997,,,approved,Metabolic,,approved_control,Approved controls (success),CCOC1=C(C=CC(=C1)CC(=O)N[C@@H](CC(C)C)C2=CC=CC=C2N3CCCCC3)C(=O)O,FAEKWTJYAYMJKF-QHCPKHFHSA-N,65981,OK,1997.0,38,"This molecule is a classic 'Greaseball' masquerading as a drug. With a cLogP likely exceeding 5.0, it heavily violates the LipE principles, relying on hydrophobic bulk for affinity rather than specific polar interactions. The N-phenylpiperidine moiety is a clever medicinal chemistry trick: by conjugating the nitrogen lone pair into the phenyl ring, the pKa drops to ~5.2, effectively neutralizing the hERG pharmacophore risk that a typical basic amine would carry. However, the carboxylic acid moiety is a double-edged sword; while likely the primary pharmacophore anchor, it introduces a significant liability for acyl glucuronide formation. In a highly lipophilic scaffold, acyl glucuronides can covalently bind to hepatic proteins, creating a substantial risk for idiosyncratic Drug-Induced Liver Injury (DILI). The molecule will likely suffer from high plasma protein binding (>98%) and rapid oxidative metabolism at the piperidine and isobutyl soft spots. It is a potent binder, but developability is compromised by its reliance on lipophilicity. Tox Summary: Clean of hard mutagenic alerts, but high DILI risk markers.",Low,"Carboxylic acid (Acyl glucuronide formation), N-phenylpiperidine (oxidative liability), Benzylic/Allylic sites",0.85,Low risk of acute toxicity or hERG (due to low pKa). Unlikely to be mutagenic. Passes safety filters.,0.6,"High permeability and likely high potency (hydrophobic collapse). Efficacy probability is decent, provided the target is validated.",0.4,Significant attrition risk due to DILI potential (Rule of Two: High LogP + High Dose/Acid) and drug-drug interactions (CYP substrate).,0.2
Omeprazole,,Proton pump inhibitor,H+/K+-ATPase (Proton Pump),GERD/Ulcer,Approved,1989,,,approved,GI,,approved_control,Approved controls (success),CC1=CN=C(C(=C1OC)C)CS(=O)C2=NC3=C(N2)C=C(C=C3)OC,SUBDBMMJDZJVOS-UHFFFAOYSA-N,4594,OK,1989.0,28,"Physicochemically, this molecule is in the 'Goldilocks Zone': MW ~345, cLogP ~2.3, and TPSA ~80 Å² indicate excellent oral bioavailability and potential CNS penetration. However, chemically, it presents a significant 'Dr. Jekyll and Mr. Hyde' profile. The core scaffold (2-pyridylmethylsulfinylbenzimidazole) contains a chiral sulfoxide linker that is notoriously acid-labile. In acidic environments, this motif rearranges to form a highly reactive sulfenamide electrophile. If the target is not a gastric proton pump (where this reactivity is the mechanism of action), this instability is a massive developability liability requiring enteric coating to prevent degradation in the stomach. Furthermore, the chiral sulfur creates a racemate issue, likely necessitating chiral resolution for modern regulatory approval. Metabolic stability is predicted to be low due to multiple 'soft spots': rapid sulfoxide oxidation/reduction and CYP-mediated O-demethylation of the electron-rich methoxy groups. While the physicochemical chassis is elite, the chemical reactivity implies a short half-life and potential for idiosyncratic toxicity via covalent binding if not strictly controlled. Tox Summary: Manageable with formulation, but chemically fragile.",Low,"Sulfoxide linker (Redox active/Acid labile precursor to reactive sulfenamide), Benzimidazole moiety (Potential CYP heme coordination/inhibition), Electron-rich Pyridine (Bioactivation risk).",0.85,Safety profile is likely manageable in short-term dosing despite the reactive potential; major risk is PK variability due to extensive metabolism (CYP2C19/3A4 polymorphism sensitivity).,0.6,"Efficacy is contingent on the specific target residence time. If this is a reversible inhibitor, the short half-life (driven by metabolic instability) will hurt trough coverage. If covalent, PD outlasts PK.",0.45,Commercial viability is strong if formulation hurdles (acid stability) are overcome. Long-term safety risks include DDI potential (CYP inhibition) and gastric changes if the mechanism is PPI-like.,0.55
Lansoprazole,,Proton pump inhibitor,H+/K+-ATPase (Proton Pump),GERD/Ulcer,Approved,1995,,,approved,GI,,approved_control,Approved controls (success),CC1=C(C=CN=C1CS(=O)C2=NC3=CC=CC=C3N2)OCC(F)(F)F,MJIHNNLFOKEZEW-UHFFFAOYSA-N,3883,OK,1995.0,45,"Physicochemically, this molecule is a 'Goldilocks' candidate. With a MW < 370, cLogP ~3.0, and TPSA ~87, it sits perfectly in the oral bioavailability sweet spot. The use of the trifluoroethoxy group is a smart metabolic block that modulates lipophilicity without blowing up the MW. However, the chemical structure harbors a significant liability: the 2-pyridylmethylsulfinylbenzimidazole core. This scaffold is chemically anxious. The sulfoxide activates the benzimidazole C-2 position, making it susceptible to intramolecular nucleophilic attack by the pyridine nitrogen, particularly in acidic media. This acid-catalyzed rearrangement generates a highly reactive sulfenamide species. Unless the specific mechanism of action requires covalent modification in a low-pH compartment, this instability is a massive developability hurdle (requiring enteric coating) and a toxicity risk (haptenization/DILI) due to non-specific protein binding. Furthermore, the sulfoxide introduces a chiral center, complicating the development (racemate vs. enantiomer) and introducing polymorphic metabolic clearance risks (CYP2C19/3A4). It is a high-maintenance molecule.",Medium,"Sulfoxide-activated benzimidazole (precursor to reactive sulfenamide electrophiles), Pyridine-Benzimidazole axis (CYP inhibition risk).",0.65,"Physicochemical properties favor good exposure, but the potential for reactive metabolite formation and CYP inhibition introduces safety flags that will require careful dose-escalation.",0.35,"High inter-patient variability in PK is expected due to the sulfoxide's susceptibility to polymorphic CYPs (e.g., 2C19). Acid instability may lead to erratic absorption if not perfectly formulated.",0.15,"Long-term safety concerns regarding idiosyncratic toxicity (DILI) from the reactive sulfenamide intermediate limit the commercial ceiling compared to cleaner, reversible competitors.",0.42
Famotidine,,H2 receptor antagonist,Histamine H2 receptor,GERD/Ulcer,Approved,1986,,,approved,GI,,approved_control,Approved controls (success),C1=C(N=C(S1)N=C(N)N)CSCC/C(=N/S(=O)(=O)N)/N,XUFQPHANEAPEMJ-UHFFFAOYSA-N,5702160,OK,1986.0,45,"This molecule is a 'Polarity Bomb'. While the Molecular Weight (~337 Da) is pristine and offers significant developability credit, the physicochemical profile is heavily skewed towards hydrophilicity (cLogP < 0). The structure is drowning in Hydrogen Bond Donors (Guanidine + Amidine + Sulfonamide), resulting in a TPSA that likely exceeds 140 Å², a hard ceiling for passive membrane permeability. You have effectively designed a Class III (High Solubility, Low Permeability) compound. The thioether linker presents a metabolic soft spot for FMO/CYP-mediated S-oxidation, though renal clearance will likely dominate due to the extreme polarity. While it lacks 'Grease' (a positive), the lack of lipophilic balance suggests poor oral bioavailability (<50%). It is a potent binder driven by enthalpy, but getting it out of the gut will be the main challenge. Tox Summary: Clean.",Medium,"Thioether (S-oxidation liability), Primary Sulfonamide (Idiosyncratic hypersensitivity risk)",0.85,Low intrinsic toxicity. High polarity reduces DILI and hERG risks significantly. Safety profile likely benign.,0.45,"Efficacy is contingent on exposure. With such high TPSA and HBD count, oral bioavailability will be the attrition driver. If the target is systemic, this is a high-risk candidate for PK failure.",0.35,"If PK hurdles are cleared (or accepted), the molecule is likely safe for chronic use due to low lipophilicity and lack of reactive toxicophores.",0.98
Ranitidine,,H2 receptor antagonist,Histamine H2 receptor,GERD/Ulcer,Approved,1983,,,approved,GI,,approved_control,Approved controls (success),CN/C(=C\[N+](=O)[O-])/NCCSCC1=CC=C(O1)CN(C)C,VMXUWOKSQNHOCA-UKTHLTGXSA-N,3001055,OK,1983.0,88,"This structure is a textbook example of 'medicinal chemistry from a bygone era' that fails modern safety audits. The central scaffold relies on a Furan ring, a notorious structural alert for Mechanism-Based Inhibition (MBI) of CYP450s; metabolic activation of the furan to reactive cis-enedials poses a severe risk of idiosyncratic hepatotoxicity (DILI). The polar 'push-pull' 1,1-diamino-2-nitroethene moiety serves as a urea isostere but introduces significant genotoxicity concerns and chemical instability. Critically, the presence of a dimethylamine (DMA) tail in the same molecule as a nitro-vinyl group creates a high-probability vector for the formation of potent mutagenic N-nitrosamines (e.g., NDMA) via degradation or nitrosation conditions. While the low cLogP indicates high aqueous solubility, the convergence of a bioactivation alert (Furan) and a mutagenicity alert (Nitroethene/Nitrosamine risk) renders this undevelopable as a modern NCE. Tox Summary: Not Clean.",Low,"Furan ring (MBI/Reactive Metabolites), 1,1-diamino-2-nitroethene (Genotox/Michael Acceptor), Dimethylamine (Nitrosamine precursor), Thioether (S-oxidation liability)",0.15,High likelihood of failure in GLP tox or Phase 1 due to furan-mediated liver enzyme elevation or positive Ames test results linked to the nitro-vinyl/nitrosamine impurities.,0.3,"If safety signals are ignored, the molecule is highly polar and likely potent against its GPCR target, but rapid clearance via S-oxidation and N-demethylation would necessitate high/frequent dosing.",0.05,"Chronic administration would likely reveal carcinogenic potential (nitrosamines) or cumulative hepatotoxicity, leading to late-stage failure or market withdrawal.",0.05
Domperidone,,D2 antagonist (peripheral),Peripheral Dopamine D2 receptors,Gastroparesis,Approved,1978 (Belgium/Switzerland),,,approved,GI,,approved_control,Approved controls (success),C1CN(CCC1N2C3=C(C=C(C=C3)Cl)NC2=O)CCCN4C5=CC=CC=C5NC4=O,FGXWKSZFVQUSTL-UHFFFAOYSA-N,3151,OK,1978.0,78,"This molecule presents a textbook 'hERG Pharmacophore': a central basic nitrogen (piperidine, pKa ~8.5) connected via a flexible 3-carbon methylene spacer to a neutral aromatic plane (benzimidazolone), flanked by a second lipophilic aromatic moiety. While the physicochemical properties (MW ~425, cLogP ~3.5, TPSA ~75) are technically within the 'Goldilocks' zone for oral bioavailability, the specific topology creates a high probability of Kv11.1 channel blockade and subsequent QT prolongation. The bis-benzimidazolone scaffold suggests high affinity for GPCRs (likely D2/5-HT), but the lack of steric occlusion around the basic amine exposes it to promiscuous binding. Furthermore, while TPSA < 90 suggests BBB permeability, the molecule is likely a P-gp substrate; if not, CNS adverse effects (EPS) would be a major liability alongside the cardiac risk. This represents an antiquated 'dirty drug' profile that would struggle to pass modern safety gates. Tox Summary: Not Clean (High hERG Liability).",Medium,"Basic Piperidine-Propyl-Aromatic Motif (hERG Pharmacophore), Bis-aryl urea systems",0.2,High risk of QT prolongation and hERG inhibition in preclinical safety assays. Likely 'No Go' decision before FIH.,0.45,"If safety gates are passed, the scaffold is a validated GPCR privileged structure with likely high potency.",0.1,Commercial viability severely limited by cardiac safety monitoring requirements or Black Box warnings.,0.09
Loperamide,,Peripheral opioid agonist,Peripheral _-opioid receptors,Diarrhea,Approved,1976,,,approved,GI,,approved_control,Approved controls (success),CN(C)C(=O)C(CCN1CCC(CC1)(C2=CC=C(C=C2)Cl)O)(C3=CC=CC=C3)C4=CC=CC=C4,RDOIQAHITMMDAJ-UHFFFAOYSA-N,3955,OK,1976.0,78,"This molecule is a physicochemical 'Grease Ball' that triggers multiple high-severity structural alerts. The scaffold features a central quaternary carbon bearing two lipophilic phenyl rings, linked via a flexible ethyl chain to a basic piperidine nitrogen. This specific architecture (diphenylbutyl-amine) is the textbook definition of a hERG pharmacophore, creating an immediate and severe risk of QT prolongation and Torsades de Pointes. 

With a molecular weight approaching 480 and a cLogP likely exceeding 5.0, the molecule violates the 'Grease Tax' rule; affinity is likely driven by non-specific hydrophobic collapse rather than precise molecular recognition. The low TPSA (< 50 Å²) relative to the high mass suggests very poor aqueous solubility and high plasma protein binding. Furthermore, the combination of a basic amine and high lipophilicity is a strong signal for P-gp efflux, which would severely limit CNS penetration if that is the intent, or trap the drug in lipid membranes. While the dimethylamide and tertiary alcohol provide some metabolic handles, they are insufficient to offset the massive lipophilic burden. In a modern discovery pipeline, this structure would be flagged as a 'Hard Kill' candidate due to the cardiotoxicity risk profile. Tox Summary: Not Clean (High hERG Liability).",Medium,"Diphenylbutyl-piperidine motif (hERG Pharmacophore), 4-chlorophenyl moiety (Lipophilicity driver)",0.35,High risk of failure due to preclinical cardiovascular safety signals (hERG inhibition). The safety window will likely be narrow.,0.4,"If safety is managed, potency is likely high due to lipophilic driving forces, but poor solubility may complicate formulation and bioavailability.",0.2,Chronic safety concerns regarding cardiac accumulation and potential phospholipidosis would threaten commercial viability.,0.28
