compound,Alias,target_class,specific_target,indication,max_phase,year-approved,year_stopped,primary_safety_signal,category,therapeutic_area,failure_type,MedChem_Descriptor_Tag,Outcome_Granularity,isomeric,inchikey,cid,status,year_clean,Edward Score V22,Rationale V22,metabolic_stability_estimate,potential_toxic_fragments,P1 Prob V22,P1 Rationale V22,P2 Prob V22,P2 Rationale V22,P3 Prob V22,P3 Rationale V22,TCSP V22,salah_verdict,biological_risk
AB-506,,HBV capsid inhibitor,Hepatitis B virus (HBV) core protein,Hepatitis B,Phase 1,,2019,ALT flares/liver injury,clinical_failure,Infectious,tox_safety,hepatotoxicity,Discontinued for safety/tox,CN1C=NC(=N1)COC(=O)N[C@H]2CCC3=C(C=CC(=C23)F)C(=O)NC4=CC(=C(C=C4)F)Cl,DMJDVZSGLNPLSS-KRWDZBQOSA-N,142433688,OK,2019.0,92,"This molecule is a textbook example of 'Molecular Obesity' driven by potency chasing in a clinically redundant target class. The scaffold relies on a rigid, lipophilic fluoro-tetralin core and a di-halogenated aniline tail to drive affinity, resulting in a cLogP that likely breaches 4.0 and a MW pushing 480. The N-methylimidazole is a transparent 'solubility patch' applied to a lipophilic brick, introducing CYP inhibition risk (heme coordination) without solving the underlying metabolic liability of the benzylic carbons on the tetralin ring. The carbamate linker adds unnecessary complexity and a potential hydrolysis vector. Critically, the Bio-Advisory is the executioner here: developing a high-dose (>200mg), lipophilic, halogen-rich agent for a population with compromised liver function (HBV/Cirrhosis) is toxicological suicide. The 'Rule of Two' (High Dose + High LogP) combined with the halogenated aromatic payload flags this for severe DILI potential. The structure is a 'me-too' attempt in a graveyard of failed CAMs. Tox Summary: Not Clean.",Low,"N-methylimidazole (CYP Inhib/DDI), 3-chloro-4-fluoroaniline substructure (Reactive Metabolite/DILI), Benzylic tetralin carbons (Oxidative soft spot).",0.35,"High risk of PK variability due to solubility-limited absorption and CYP interactions. Safety in healthy volunteers may be passable, but therapeutic index will be razor-thin.",0.1,"While viral load reduction is likely, the inability to achieve HBsAg loss (functional cure) combined with ALT flares in cirrhotic patients will lead to termination.",0.01,Zero commercial viability against cheap nucleosides without a curative profile. Safety risks in chronic dosing are prohibitive.,0.0035,CAUTION,"The target is HBV Capsid Assembly Modulator (CAM). While biologically validated to reduce HBV DNA, this class is currently stuck in clinical purgatory. Multiple predecessors (e.g., Vebicorvir, NVR 3-778) failed to demonstrate the 'Holy Grail' of HBsAg loss (functional cure) despite potent viral replication suppression. The mechanism is sound for viral load reduction, but clinically redundant alongside cheap, safe Nucleos(t)ide analogues unless it drives cure—which it hasn't. Furthermore, CAMs typically require high daily doses (>200-400mg) to maintain trough coverage. Administering a high-dose, lipophilic small molecule with halogenated aromatic moieties to patients with compromised liver function (fibrosis/cirrhosis) creates a razor-thin safety margin for DILI. The halogenated aniline substructure is a metabolic red flag for reactive metabolite formation."
Taranabant,,CB1 inverse agonist,Cannabinoid receptor 1 (CB1),Obesity,Phase 3,,2008,Psychiatric adverse effects,clinical_failure,Metabolic,tox_safety,neurotoxicity,Discontinued for safety/tox,C[C@@H]([C@@H](CC1=CC=C(C=C1)Cl)C2=CC=CC(=C2)C#N)NC(=O)C(C)(C)OC3=NC=C(C=C3)C(F)(F)F,QLYKJCMUNUWAGO-GAJHUEQPSA-N,11226090,OK,2008.0,98,"This molecule is a textbook definition of a 'Lipophilic Brick' (MW > 500, cLogP > 5.5). While the TPSA (~75 Å²) and HBD count (1) are tuned for CNS penetration, the affinity is driven almost entirely by 'Grease' (Chlorophenyl, Cyanophenyl, CF3-Pyridine). This violates the fundamental LipE directive; you are buying potency with lipophilicity, which guarantees poor solubility and high non-specific binding. Structurally, the gem-dimethyl ether and electron-deficient pyridine are clever metabolic blocks, likely yielding a long half-life, but this exacerbates the risk by ensuring high accumulation of a greasy drug in lipid-rich tissues (Brain/Liver). However, the chemistry is secondary to the Biological Advisory. This structure is designed to penetrate the BBB to hit a target (Central CB1) where target engagement is synonymous with psychiatric toxicity (anhedonia/suicidality). You have effectively engineered a highly bioavailable delivery system for depression. The 50-point penalty is applied. Tox Summary: NOT CLEAN.",High,"Highly lipophilic aromatic clusters (Phospholipidosis/DILI risk), Nitrile moiety, Central CB1 Pharmacophore (Psychiatric Adverse Events).",0.2,High risk of early CNS adverse events (anxiety/mood changes) in volunteers. High lipophilicity may also trigger liver enzyme elevations.,0.05,Efficacy in weight loss will be overshadowed by unacceptable psychiatric attrition. The therapeutic window is non-existent.,0.01,Regulatory agencies will not approve a mechanism with this safety profile for a non-life-threatening indication.,0.05,TERMINATE,"This molecule is Taranabant (MK-0364). You have selected a target from the absolute nadir of metabolic clinical failures. Central CB1 inverse agonism is a mechanism defined by the 'Rimonabant Effect': effective weight loss accompanied by unacceptable neuropsychiatric toxicity (anxiety, depression, and suicidality). The biology is unforgiving here; the endocannabinoid system regulates mood and stress response in the CNS. By blocking it to treat obesity, you are chemically inducing anhedonia. Historical data confirms that the therapeutic window is non-existent—doses required for efficacy overlap 1:1 with doses causing psychiatric adverse events. This is a graveyard target."
Otenabant,,CB1 antagonist,Cannabinoid receptor 1 (CB1),Obesity,Phase 2,,2009,CNS safety concern,clinical_failure,Metabolic,tox_safety,neurotoxicity,Discontinued for safety/tox,CCNC1(CCN(CC1)C2=NC=NC3=C2N=C(N3C4=CC=C(C=C4)Cl)C5=CC=CC=C5Cl)C(=O)N,UNAZAADNBYXMIV-UHFFFAOYSA-N,10052040,OK,2009.0,98,"This molecule is a structural catastrophe for the proposed indication. Chemically, it is a 'Brick' (MW > 500) with a cLogP likely pushing 5.0, driven by the 'Grease' of the bis-chlorophenyl motif. The scaffold—a 8,9-diarylpurine—is a privileged template for Kinase inhibition, not GPCRs, implying a massive 'Selectivity Tax' and high risk of off-target promiscuity. Structurally, the combination of a basic piperidine/ethylamine center linked to a massive hydrophobic aromatic core constitutes a textbook hERG pharmacophore, guaranteeing cardiovascular safety liabilities in Phase 1. Crucially, the Bio-Advisory is chemically sound: the lipophilic aromatic bulk overwhelms the polar surface area of the amide headgroup, ensuring high BBB permeability. For a CB1 antagonist, CNS entry is not a feature; it is a toxicity trigger (anxiety/suicidality). You have effectively designed a heavy, promiscuous, hERG-active kinase inhibitor and attempted to deploy it as a chronic metabolic drug in a target class with zero regulatory tolerance for CNS adverse events. The historical penalty is applied in full. Tox Summary: Not Clean (CNS/hERG/Kinome).",Medium,"Bis-chlorophenyl purine core (Kinase promiscuity/Lipophilicity), Basic piperidine-linker-aromatic motif (hERG pharmacophore), Ethylamino side chain (N-dealkylation hotspot).",0.1,High risk of QT prolongation (hERG) and early CNS adverse events (anxiety/nausea) in healthy volunteers due to off-target kinase activity and CB1 central antagonism.,0.05,"Even if efficacy (weight loss) is observed, the psychiatric safety signal (depression/suicidality) inherent to central CB1 blockade will manifest, leading to termination.",0.01,Regulatory agencies will not approve a central CB1 antagonist for lifestyle indications given the historical precedent. The risk/benefit profile is inverted.,0.01,TERMINATE,"You have chosen to resurrect one of the most notorious clinical graveyards in pharmacovigilance history. This molecule targets CB1 for metabolic indications (obesity/diabetes), a mechanism validated for efficacy (weight loss) but doomed by safety. The structure features a highly lipophilic bis-chlorophenyl motif fused to a purine-like core, which is a classic recipe for high Blood-Brain Barrier (BBB) penetration. Central CB1 antagonism (the 'Rimonabant Effect') is inextricably linked to severe neuropsychiatric toxicity, including anxiety, depression, and suicidality. Unless this molecule possesses engineered physicochemical properties to ensure >98% peripheral restriction (e.g., high TPSA or P-gp substrate status)—which this lipophilic scaffold does not suggest—it will enter the CNS. The FDA has zero tolerance for psychiatric adverse events in lifestyle/metabolic drugs. Furthermore, recent failures of 'peripherally restricted' candidates (e.g., Monlunabant showing psychiatric signals) suggest the peripheral-central separation is clinically elusive. This is a suicide mission."
BMS-986020,,LPA1 antagonist,Lysophosphatidic acid receptor 1 (LPA1),Idiopathic pulmonary fibrosis,Phase 2,,2018,Hepatobiliary toxicity,clinical_failure,Respiratory,tox_safety,hepatotoxicity,Discontinued for safety/tox,CC1=NOC(=C1NC(=O)O[C@H](C)C2=CC=CC=C2)C3=CC=C(C=C3)C4=CC=C(C=C4)C5(CC5)C(=O)O,GQBRZBHEPUQRPL-LJQANCHMSA-N,49792850,OK,2018.0,94,"This structure is a medicinal chemistry 'Dead End'. Structurally, it presents as a 'Lipophilic Acidic Brick' (MW ~480, high cLogP masked only by the ionizable group). The central biphenyl scaffold acts as a massive hydrophobic slab, inflating lipophilicity and reducing solubility (Brick Dust risk) without adding specific polar vectors for selectivity. Crucially, the combination of a large, rigid lipophilic backbone with a terminal carboxylic acid is the canonical pharmacophore for BSEP (Bile Salt Export Pump) inhibition. Blockade of BSEP is a primary driver of drug-induced cholestasis and liver injury. Furthermore, the carbamate linker is a metabolic liability; systemic hydrolysis would release a substituted aminoisoxazole, a motif frequently associated with idiosyncratic toxicity via reactive metabolite formation. The Bio-Advisory confirms the structural diagnosis: the requirement for high daily doses (likely due to high clearance of the greasy scaffold) pushes the liver exposure into the toxic window defined by the BSEP liability. This is a compound that fights its own physicochemical properties to achieve efficacy, losing the safety war in the process. Tox Summary: NOT CLEAN (High DILI/BSEP Risk).",Low,"Lipophilic Biphenyl Acid (BSEP Pharmacophore), Carbamate linker (Hydrolysis risk), Aminoisoxazole (Reactive metabolite precursor)",0.2,High risk of transaminase elevations (ALT/AST) due to BSEP inhibition and high metabolic burden.,0.05,Historical attrition in this chemotype is catastrophic. The therapeutic window between lung efficacy and liver toxicity is likely non-existent.,0.01,Chronic dosing of a BSEP inhibitor with high daily load is commercially unviable and ethically dubious.,0.1,TERMINATE,"This molecule belongs to the BMS-986020 chemotype (isoxazole carbamate scaffold), a lineage infamous for high-profile clinical failure. While LPA1 is a mechanistically sound target for IPF, the clinical reality is a graveyard. BMS-986020 was terminated in Phase 2 due to cases of cholecystitis and cholestasis, driven by BSEP inhibition and high daily dose burden (600mg BID). Furthermore, the catastrophic Phase 3 failure of GLPG1690 (Ziritaxestat) for futility and mortality signals casts a massive shadow over the class. This scaffold requires high systemic exposure to achieve receptor occupancy in the fibrotic lung, pushing the liver to its breaking point. You are trying to drug a target that kills programs with a scaffold that kills livers."
LY3023703,,mPGES-1 inhibitor,Microsomal prostaglandin E synthase-1 (mPGES-1),Pain,Phase 1,,2018,Reactive metabolite DILI,clinical_failure,Pain,tox_safety,hepatotoxicity,Discontinued for safety/tox,CC1=C(N=C(N1)NC(=O)C2=C(N=CC(=C2)CNC(=O)C(C)C)C(F)F)C3=CC=C(C=C3)C(F)(F)F,BZYSILFNUIGABU-UHFFFAOYSA-N,71059525,OK,2018.0,96,"This candidate is a 'Molecular Brick' attempting to drug a 'Ghost Target'. Structurally, the molecule violates the MW < 500 Da golden rule (MW ~508 Da), creating an immediate developability penalty. The scaffold features a high Aromatic Ring Count (3) and significant planarity across the acyl-aminoimidazole core, suggesting high crystalline lattice energy and 'Brick Dust' solubility profiles (likely < 1 µM). While the cLogP (~3.5-4.0) is technically within range, the heavy fluorination (CF3, CHF2) pushes the LipE down when adjusted for the excessive molecular weight. The 'Rule of Two' (cLogP > 3 + MW > 400) combined with the Bio-Advisory's prediction of a high daily dose (>200mg) flags this as a Tier-1 DILI risk. The acyl-aminoimidazole motif is also historically promiscuous, often hitting kinases, which complicates the safety profile further. Integrating Salah's 'Siren Song' penalty (+45 points) for the mPGES-1 translational disconnect and the 'Shunting Effect' risk, this program is a capital-intensive dead end. Tox Summary: Not Clean (DILI + Mechanism-Based CV/GI Risk).",Medium,"Acyl-aminoimidazole core (hydrolytic instability/kinase promiscuity), Benzylic amide linker (metabolic soft spot), High Fluorine content (environmental persistence).",0.3,High risk of attrition due to poor PK (solubility-limited absorption) and potential off-target safety signals from the promiscuous core.,0.05,"The mPGES-1 translational disconnect is fatal. Rodent models do not predict human efficacy, and the 'Shunting Effect' may negate analgesic benefits.",0.01,Commercial viability is near zero given the genericized pain market and the high probability of idiosyncratic toxicity (DILI) at the required high doses.,0.015,TERMINATE,"mPGES-1 is the 'Siren Song' of the inflammation world. Theoretically, it promises the analgesia of Vioxx without the cardiovascular thrombosis (by sparing PGI2) or the GI bleed of Naproxen. In reality, it is a translational graveyard. First, the structural divergence between human and rodent mPGES-1 renders standard preclinical efficacy models useless; human potency is notoriously difficult to achieve. Second, the 'Shunting Effect'—where blocking PGE2 forces arachidonic acid into other prostanoid pathways—creates unpredictable biological noise. Clinically, giants like AstraZeneca (AZD1981) and Lilly (LY3023703) have failed in Phase II due to lack of efficacy compared to standard-of-care NSAIDs. To achieve necessary enzyme occupancy in inflamed tissue, you will likely need a high daily dose (>200mg), inviting DILI risks in a crowded, genericized pain market."
LY3031207,,mPGES-1 inhibitor,Microsomal prostaglandin E synthase-1 (mPGES-1),Pain,Phase 1,,2019,Phase 1 DILI,clinical_failure,Pain,tox_safety,hepatotoxicity,Discontinued for safety/tox,CC(C)(C)C(=O)NCC1=CC(=C(C=C1)Cl)C(=O)NC2=NC=CN2,MBAHGUNQNAJTLD-UHFFFAOYSA-N,57382526,OK,2019.0,62,"Chemically, this molecule is a seductive siren. It possesses 'Elite' physicochemical properties: MW < 350, cLogP estimated in the Goldilocks zone (2.0-2.5), and a TPSA (~85 Å²) that balances permeability with solubility. The use of a pyrazine amide is a sophisticated bioisostere for a phenyl ring, significantly lowering lipophilicity (LipE boost) and reducing the 'Grease Tax' liability common in this target class. The tert-butyl group provides necessary hydrophobic bulk without introducing rotatable bond bloat. Structurally, it is a 'Compact Probe' with no obvious reactive toxicophores or hERG pharmacophores (neutral/weakly acidic character precludes K+ channel trapping). 

However, I cannot ignore the Biological Advisory. While the chemistry scores a 20 (Excellent), the mandatory 35-point penalty for the 'Graveyard Target' pushes this into the 'Caution' zone. The risk of 'Substrate Shunting' (PGH2 redirection to TXA2) introduces a mechanism-based cardiovascular liability that mimics the COX-2 disaster, rendering the clean structural tox irrelevant in a chronic setting. Furthermore, the species homology disconnect implies that excellent rodent potency is likely a mirage. You have built a Ferrari for a road that leads off a cliff. 

Tox Summary: Clean Structure, Dirty Mechanism.",High,None (Clean Scaffold),0.85,"The scaffold is chemically benign. Low MW, lack of basic amines (hERG safety), and absence of structural alerts suggest a smooth Phase 1 safety profile in healthy volunteers.",0.2,"High attrition risk. Efficacy is doubtful due to species differences in the enzyme pocket. Even if target engagement occurs, 'Substrate Shunting' may negate analgesic benefits or cause early safety signals.",0.05,"Commercial viability is near zero. To succeed, it must prove superior CV safety to Celebrex while matching opioid-sparing analgesia. The mechanism suggests it will fail the former.",0.28,CAUTION,"The mPGES-1 inhibitor class is the 'Holy Grail' that keeps turning into a poisoned chalice. Theoretically, it promises the analgesia of COX-2 inhibitors without the cardiovascular toxicity (by sparing PGI2) or GI bleeds. In reality, this target is a graveyard of efficacy failures (Pfizer, Merck, Boehringer Ingelheim). The biological risk is 'Substrate Shunting': blocking mPGES-1 causes an accumulation of PGH2, which may redirect into PGD2 or TXA2 pathways, negating safety benefits or causing unexpected adverse events. Furthermore, achieving sufficient enzyme occupancy in inflamed tissue to rival Naproxen usually requires high plasma exposures. While this specific scaffold (tert-butyl/amide/pyrazine) is low MW and avoids the 'brick-dust' lipophilicity of early generation inhibitors, the clinical bar is impossibly high: you must beat placebo on pain AND prove superior CV safety to Celebrex to be commercially viable. High attrition risk due to lack of translation from rodent models (significant species homology differences in mPGES-1) to humans."
GT-1,,Antibiotic,Bacterial Siderophore-Cephalosporin conjugate (targets cell wall),FIH volunteers,Phase 1,,2018,Safety signal,clinical_failure,Infectious,tox_safety,hepatotoxicity,Discontinued for safety/tox,CC(C)(C(=O)O)O/N=C(/C1=C(SC(=N1)N)Cl)\C(=O)N[C@H]2[C@@H]3N(C2=O)C(=C(CS3)C[N+]4=CN=C(C(=C4)NCCNC(=O)C5=CC(=O)C(=CN5O)O)N)C(=O)[O-],WUCKZQNKKIJUSF-UVXYUCGCSA-N,145283404,OK,2018.0,78,"This molecule is a structural 'Frankenstein'—a massive, hyper-polar siderophore-cephalosporin conjugate that abandons all pretense of LipE or passive permeability in favor of a 'Trojan Horse' active transport mechanism. While the chloro-aminothiazole oxime core provides robust beta-lactamase stability, the sheer molecular weight and polarity (zwitterionic quaternary ammonium + multiple carboxylates) relegate this strictly to IV administration with rapid renal clearance. The chemical fragility of the siderophore moiety (hydroxypyridinone-type chelator) combined with the beta-lactam's inherent hydrolytic instability creates a formulation nightmare. Crucially, the Bio-Advisory's note on 'Mortality Imbalance' aligns with the chemical intuition: this molecule is a solute-load heavy, tissue-impermeable entity that likely fails to achieve adequate residence time in deep compartments (e.g., lung surfactant) or intracellular niches, leading to the observed clinical disconnect. It is a desperate engineering solution, not a medicinal chemistry triumph. The 25-point penalty is applied for the high risk of transporter-based resistance and the historical clinical stigma. Tox Summary: Clean (Liver), but Efficacy/Safety ratio is inverted.",High (Renal Clearance),"Beta-lactam ring (immunogenicity), Hydroxypyridinone siderophore (metal chelation/redox risk), Quaternary ammonium (neuromuscular effects at high dose)",0.85,Beta-lactams generally pass Phase 1 safety easily due to lack of off-target pharmacology in humans (no cell wall targets) and rapid renal elimination.,0.55,"Microbiological efficacy is potent in vitro, but the 'Trojan Horse' mechanism is prone to rapid resistance development via transporter downregulation in vivo.",0.2,The 'Mortality Imbalance' stigma and PK/PD disconnect in complex infections (pneumonia) severely cap the probability of broad approval or commercial success.,0.09,CAUTION,"This is a siderophore-conjugated cephalosporin (Cefiderocol analog), utilizing a 'Trojan Horse' mechanism to exploit bacterial iron transport systems. While this elegantly bypasses porin-loss resistance in MDR Gram-negatives (specifically Carbapenem-resistant Enterobacteriaceae and Acinetobacter), the biological feasibility is marred by clinical reality. 1) The 'Trojan Horse' strategy is historically fragile; bacteria rapidly downregulate iron receptors under pressure, leading to resistance. 2) The dose requirement is massive (grams per day), relying heavily on renal clearance. While beta-lactams spare the liver, the sheer solute load is non-trivial. 3) Most critically, the class carries a 'Mortality Imbalance' stigma (observed in the CREDIBLE-CR trial), where despite potent in vitro MICs, in vivo efficacy in complex pneumonia/sepsis (especially Acinetobacter) lagged behind standard of care. The PK/PD disconnect in deep tissue compartments remains a significant liability."
Aleglitazar,,PPAR agonist,Dual PPAR$\alpha$ and PPARgamma receptors,T2D,Phase 3,,2013,HF/renal imbalance,clinical_failure,Metabolic,tox_safety,renal_toxicity,Discontinued for safety/tox,CC1=C(N=C(O1)C2=CC=CC=C2)CCOC3=C4C=CSC4=C(C=C3)C[C@@H](C(=O)O)OC,DAYKLWSKQJBGCS-NRFANRHFSA-N,10274777,OK,2013.0,94,"This molecule represents a textbook 'Greasy Acid' trap. Chemically, it combines a highly lipophilic tail (benzothiophene-oxazole system) with a carboxylic acid headgroup. While the alpha-methoxy substitution on the propionic acid tail is a medicinal chemistry trick to block beta-oxidation and modulate PPAR subtype selectivity, it does not mitigate the fundamental liability: cLogP > 4.0 combined with a carboxylic acid triggers the 'Rule of Two' for DILI risk. The formation of acyl glucuronides from this moiety is a significant concern; these conjugates can act as electrophiles, covalently binding to hepatic proteins and triggering idiosyncratic toxicity. Furthermore, the benzothiophene core is susceptible to S-oxidation, adding metabolic complexity. However, the chemistry is secondary to the biological verdict. As noted by the Bio-Advisory, this scaffold is structurally synonymous with the 'glitazar' class of dual PPAR agonists. The intrinsic mechanism-based toxicity (fluid retention, edema, CHF) combined with the chemical risk of DILI makes this a non-starter. The 50-point penalty is fully applied, pushing this into the 'Trash' tier. No amount of potency can salvage a mechanism that requires massive CV outcome trials with a high probability of failure.",Medium,"Carboxylic acid (Acyl glucuronide formation/DILI risk), Benzothiophene (S-oxidation), High Lipophilicity (Phospholipidosis risk).",0.3,Risk of early safety signals (fluid retention) in multiple ascending dose studies. Acyl glucuronide formation may flag DILI concerns early.,0.1,"While likely efficacious for glucose/lipids, the therapeutic window is non-existent due to edema and weight gain. High attrition rate in this class.",0.01,Regulatory requirement for CV outcome trials is a death sentence for this mechanism. History suggests a high risk of CV mortality or renal failure signals.,0.0003,TERMINATE,"You have presented a PPAR agonist, structurally reminiscent of the failed 'glitazar' dual agonists (PPAR alpha/gamma). This target class is a definitive clinical graveyard. While these molecules lower glucose and lipids effectively, the PPAR-gamma component carries an intrinsic, mechanism-based toxicity profile: renal sodium retention leading to fluid overload, peripheral edema, and exacerbation of congestive heart failure. The history of this class is littered with late-stage disasters (Muraglitazar, Tesaglitazar) due to cardiovascular mortality and renal toxicity signals. The regulatory hurdle for approval now demands massive, high-risk cardiovascular outcome trials. No amount of potency justifies the inherent biological liability of this mechanism."
