compound,Alias,target_class,specific_target,indication,max_phase,year-approved,year_stopped,primary_safety_signal,category,therapeutic_area,failure_type,MedChem_Descriptor_Tag,Outcome_Granularity,isomeric,inchikey,cid,status,year_clean,Edward Score V22,Rationale V22,metabolic_stability_estimate,potential_toxic_fragments,P1 Prob V22,P1 Rationale V22,P2 Prob V22,P2 Rationale V22,P3 Prob V22,P3 Rationale V22,TCSP V22,salah_verdict,biological_risk
Suvorexant,,Orexin receptor antagonist,OX1 and OX2 receptors,Insomnia,Approved,2014,,,approved,CNS,,approved_control,Approved controls (success),C[C@@H]1CCN(CCN1C(=O)C2=C(C=CC(=C2)C)N3N=CC=N3)C4=NC5=C(O4)C=CC(=C5)Cl,JYTNQNCOQXFQPK-MRXNPFEDSA-N,24965990,OK,2014.0,3,"This structure is a masterclass in CNS Medicinal Chemistry, bordering on perfection for a small molecule antagonist. 

1. **CNS MPO & Physicochemicals**: The molecule hits the 'Golden Triangle' of CNS penetration. MW (~450) and TPSA (~85) are ideal. Crucially, the Hydrogen Bond Donor (HBD) count is ZERO. This is the 'VIP Pass' for blood-brain barrier penetration, minimizing P-gp efflux liability. The cLogP (~3.8-4.2) is in the upper quartile but necessary for this target class; it is balanced by the polar 'anchors' (triazole and benzoxazole) to maintain solubility.

2. **Structural Architecture**: The central 1,4-diazepane core is a superior scaffold to flexible linear linkers, reducing the entropic penalty of binding. The inclusion of a single chiral methyl group (`C[C@@H]`) is a high-fidelity design choice: it likely locks the bioactive conformation and desymmetrizes the molecule to prevent metabolic redundancy, while also shielding the ring from oxidative attack.

3. **Bioisosteres & Metabolism**: The use of a 1,2,3-triazole as an ortho-substituent on the benzamide is brilliant. It provides a specific hydrogen bond acceptor vector without the metabolic liability of a pyridine or the lipophilicity of a phenyl. The 6-chlorobenzoxazole is a robust, metabolically blocked terminus.

4. **The 'Fuse'**: The benzylic methyl on the right-hand aryl ring is the designated metabolic 'soft spot' (CYP3A4 hydroxylation). This is not a flaw; it is a control rod. It ensures the molecule clears effectively to prevent next-day somnolence (hangover effect), which is the primary clinical risk for this mechanism.

5. **Safety**: Absence of a basic amine (pKa < 7) virtually eliminates hERG risk (no cation-pi interaction in the channel). The structure lacks structural alerts for genotoxicity or reactive metabolites.

**Verdict**: A surgical instrument for the Orexin receptor. High potency, clean safety profile, and tunable PK.",Medium,"None. (Benzylic methyl is a clearance site, not a toxophore).",0.92,Exceptional physicochemical profile. No hERG pharmacophore (neutral/weakly basic). No structural alerts for MBI or mutagenicity. Low projected human dose (<25mg) provides a massive safety margin.,0.75,"Mechanism is clinically validated (DORA). The molecule possesses optimal CNS properties (HBD=0), ensuring target engagement. The primary risk is PK tuning (half-life), not efficacy.",0.55,Clean safety profile and low dose burden minimize DILI and chronic tox risks. Commercial success depends strictly on differentiation (avoiding somnolence) via the metabolic handle.,0.38,ELITE,"The Orexin receptor antagonist (DORA) mechanism is clinically validated (Suvorexant, Lemborexant, Daridorexant). Unlike the BACE1 or CETP graveyards, this pathway has a clear, translatable phenotype (insomnia to sleep) without catastrophic off-target liabilities. The structure (diazepane core) suggests high potency, implying a low clinical dose burden (<25mg), which significantly mitigates the risk of idiosyncratic DILI or transporter saturation. The primary biological risk is not organ toxicity, but Pharmacokinetic precision: the half-life must be tuned perfectly to avoid 'next-day somnolence' (hangover) while maintaining sleep maintenance. This is a medicinal chemistry optimization problem, not a biological dead end."
Lemborexant,,Orexin receptor antagonist,OX1 and OX2 receptors,Insomnia,Approved,2019,,,approved,CNS,,approved_control,Approved controls (success),CC1=NC(=NC=C1OC[C@]2(C[C@H]2C(=O)NC3=NC=C(C=C3)F)C4=CC(=CC=C4)F)C,MUGXRYIUWFITCP-PGRDOPGGSA-N,56944144,OK,2019.0,12,"This is a masterclass in CNS drug design, exhibiting near-perfect alignment with the CNS MPO algorithm. The scaffold utilizes a rigid cyclopropane core to vector three distinct aromatic domains, maximizing Lipophilic Efficiency (LipE) by freezing the bioactive conformation without incurring a molecular weight penalty (MW ~410). The physicochemical profile is 'Goldilocks' zone: cLogP ~3.5, TPSA ~77 Å², and HBD=1, ensuring rapid BBB penetration and low P-gp efflux liability. The surgical placement of fluorine atoms on the phenyl and pyridine rings effectively blocks primary metabolic soft spots (para-oxidation), forcing clearance through slower, more controlled pathways (likely oxidation of the pyrimidine methyls). Crucially, the molecule lacks a basic amine (pKa < 6), completely evading the hERG pharmacophore and phospholipidosis risks common in CNS agents. The quaternary center on the cyclopropane adds 3D complexity (Fsp3), enhancing solubility and selectivity. Combined with the 'Elite' biological verdict, this is a high-probability clinical candidate. Tox Summary: Clean.",Medium-High,"None identified. (Pyrimidine methyls are metabolic soft spots, not tox alerts).",0.92,"Structure is devoid of structural alerts, hERG liabilities, or reactive metabolites. High likelihood of clean safety profile.",0.78,Mechanism is clinically validated (Orexin). Excellent CNS MPO score suggests high target engagement in the brain.,0.65,"Clean chemical structure minimizes idiosyncratic toxicity risks. Main risk is commercial differentiation, not chemistry.",0.46,ELITE,"The Orexin receptor (OX1R/OX2R) is a rare triumph in CNS drug discovery, standing in stark contrast to the BACE1 and Amyloid graveyards. The mechanism is clinically validated (Suvorexant, Lemborexant) and physiologically sound: blocking wake-promoting neuropeptides directly induces sleep. The biological risk is minimal and manageable. The primary clinical liabilities are mechanism-based extensions (next-day somnolence, rare cataplexy) rather than idiosyncratic organ toxicity. Unless the molecule has a disastrous half-life (causing 'zombie' mornings) or requires a massive dose burden (>100mg) leading to DILI, this is a winning target class."
Ramelteon,,Melatonin MT1/MT2 agonist,MT1 and MT2 receptors,Insomnia,Approved,2005,,,approved,CNS,,approved_control,Approved controls (success),CCC(=O)NCC[C@@H]1CCC2=C1C3=C(C=C2)OCC3,YLXDSYKOBKBWJQ-LBPRGKRZSA-N,208902,OK,2005.0,18,"This structure is a masterclass in CNS physicochemical compliance. With a MW ~260, cLogP ~2.8, and TPSA < 40, it exhibits 'Ghost-like' BBB permeability and exceptional Ligand Efficiency (LE). The absence of a basic amine completely eliminates the hERG pharmacophore, a rare and critical advantage in CNS medicinal chemistry. The tricyclic dihydrobenzofuran core provides excellent rigidification of the pharmacophore without the entropic penalty of rotatable bonds. However, the molecule is metabolically fragile; the electron-rich aromatic system and accessible benzylic positions on the cyclopentane ring are prime substrates for CYP oxidation (consistent with the CYP1A2 'PK Trap' noted). While this leads to high clearance, the projected low dose (<10mg) effectively mitigates the risk of reactive metabolite saturation or DILI. The 10-point penalty is applied strictly for the target class stigma, not the chemistry. Tox Summary: Clean.",Low,"None (Benzylic oxidation sites are metabolic soft spots, not toxicophores)",0.92,The lack of a basic center (hERG safety) combined with a <10mg dose projection makes the safety margin in Phase 1 exceptional.,0.65,Target engagement in the brain is guaranteed by the physicochemical profile. The risk lies in the short half-life limiting duration of action for sleep maintenance.,0.55,Clean safety profile suggests high approval probability; attrition risk is purely commercial/efficacy relative to established GABA-A modulators.,0.33,ELITE,"This structure corresponds to Ramelteon. From a systems biology perspective, the MT1/MT2 target class is biologically 'soft' but toxicologically pristine compared to the graveyards of BACE1 or CB1. 

1. **Dose-Toxicity Profile**: The clinical dose is extremely low (~8mg). This is the 'Golden Zone.' At this burden, the liver is rarely stressed, avoiding the idiosyncratic DILI that plagued Agomelatine (which required high doses and carried a naphthalene ring). 

2. **Target Validation**: The mechanism is physiological (circadian entrainment) rather than forcing a state change (like GABA-A). This eliminates respiratory depression and abuse liability. 

3. **PK/Metabolic Liability**: The only biological flaw is the massive first-pass metabolism and reliance on CYP1A2. While not toxic per se, it creates a 'PK Trap'—co-administration with strong CYP1A2 inhibitors (e.g., fluvoxamine) causes exposure to skyrocket >100-fold. 

4. **Conclusion**: Biologically feasible, chemically validated, and toxicologically safe. The risk is not killing the patient; the risk is the patient complaining it doesn't work well enough compared to Orexin antagonists."
Fingolimod,,S1P receptor modulator,"Sphingosine-1-phosphate receptors (S1P1, S1P3, S1P4, S1P5)",Multiple sclerosis,Approved,2010,,,approved,CNS,,approved_control,Approved controls (success),CCCCCCCCC1=CC=C(C=C1)CCC(CO)(CO)N,KKGQTZUTZRNORY-UHFFFAOYSA-N,107970,OK,2010.0,92,"This structure represents the antithesis of modern CNS design: a 'floppy', hyper-lipophilic detergent. The reliance on a massive, unstructured C9-alkyl chain creates an insurmountable 'Grease Tax' liability, pushing cLogP well beyond 5.5 and introducing >12 rotatable bonds ('The Balloon'). This guarantees poor LipE, high non-specific binding, and significant entropic penalties for Blood-Brain Barrier penetration. Structurally, the cationic amphiphilic motif (basic amine + lipophilic tail) is a textbook trigger for both hERG inhibition and Phospholipidosis (lysosomal trapping). Integrating the Bio-Advisory: the lack of rigid stereoelectronic constraints supports the high probability of S1P3 promiscuity (bradycardia) and unmanageable pharmacokinetics (weeks-long half-life). This is a legacy scaffold relying on brute-force hydrophobicity rather than specific molecular recognition. Tox Summary: Not Clean.",Low,"Long aliphatic chain (omega-oxidation/detergent properties), Primary amine linked to lipophile (hERG/Phospholipidosis), Aminodiol (Prodrug complexity)",0.15,High risk of immediate cardiac toxicity (bradycardia via S1P3 or QT prolongation via hERG). 'Hard Kill' alerts for phospholipidosis will likely flag in preclinical safety.,0.1,"Even if efficacy is shown, the therapeutic window will be non-existent due to the 'Grease Tax' and off-target liabilities. PK variability of the prodrug activation adds further risk.",0.05,"Chronic safety concerns (liver, macular edema) and the inability to rapidly reverse drug effects (due to extreme Vd and half-life) make this unapprovable in a modern landscape.",0.00075,CAUTION,"The structure is a close analog of Fingolimod (FTY720), a non-selective S1P receptor modulator prodrug. While the target (S1P) is validated for CNS indications like Multiple Sclerosis, the biological profile of this specific scaffold is outdated and hazardous. 1) Non-selectivity: This scaffold likely hits S1P3, which is directly linked to bradycardia and AV block (the 'first-dose' cardiac toxicity). Modern clinical development demands S1P1/5 selectivity (e.g., Siponimod, Ozanimod) to avoid this. 2) Pharmacokinetics: These lipophilic aminodiols exhibit massive tissue distribution and extremely long half-lives (weeks), making rapid reversibility impossible in the event of opportunistic infections (e.g., PML, cryptococcal meningitis). 3) Toxicity: Known class effects include macular edema and liver enzyme elevations. Developing a non-selective S1P modulator in the current landscape is biologically regressive."
Siponimod,,S1P receptor modulator,S1P1 and S1P5 receptors,Multiple sclerosis,Approved,2019,,,approved,CNS,,approved_control,Approved controls (success),CCC1=C(C=CC(=C1)/C(=N/OCC2=CC(=C(C=C2)C3CCCCC3)C(F)(F)F)/C)CN4CC(C4)C(=O)O,KIHYPELVXPAIDH-HNSNBQBZSA-N,44599207,OK,2019.0,26,"This molecule is a 'Lipophilic Brick' (MW > 500, cLogP > 5) that defies standard attrition rules strictly through extreme Lipophilic Efficiency (LipE). The design relies on a zwitterionic azetidine-3-carboxylic acid headgroup, which serves a dual purpose: it mimics the endogenous phosphate for nanomolar potency and neutralizes the hERG pharmacophore by masking the basic nitrogen. The oxime ether linker is a rigid, non-standard spacer that risks isomerism but appears locked here. The 'Grease Tax' is heavy—the cyclohexyl-phenyl-CF3 tail is a metabolic sponge, likely driving clearance via CYP2C9 hydroxylation. In a vacuum, the physicochemical properties (MW 516, high LogP) would trigger a 'Developability Penalty', but the projected low clinical dose (< 5mg) effectively nullifies the DILI risk (Rule of Two) and mitigates the metabolic burden. It is a high-risk, high-reward optimization of a dirty scaffold. Tox Summary: Clean (at low dose).",Medium,"Cyclohexyl moiety (major oxidative soft spot), Oxime ether (minor hydrolysis risk), Trifluoromethyl (lipophilicity driver).",0.85,Zwitterionic character drastically reduces hERG liability. Low dose projection ensures wide safety margins despite high lipophilicity.,0.75,"Structural vectors suggest high CNS penetration (low HBD, high permeability). Potency is sufficient to drive efficacy at low exposures.",0.65,"The heavy reliance on lipophilic metabolism (likely CYP2C9) introduces pharmacogenomic risks (slow metabolizers), which may complicate labeling but does not preclude approval.",0.78,ELITE,"This structure corresponds to Siponimod (BAF312). From a systems biology perspective, this is a masterclass in optimizing a 'dirty' mechanism. 1) Selectivity: By targeting S1P1 and S1P5 while sparing S1P3, you successfully bypass the severe bradycardia/AV-block liability that plagued Fingolimod. 2) Dose-Toxicity: The clinical dose is ~2mg. This is biologically elegant. You achieve high receptor occupancy without burdening the liver with hundreds of milligrams of xenobiotic substrate, drastically reducing idiosyncratic DILI risk. 3) CNS Penetration: The lipophilic tail ensures BBB crossing, essential for hitting S1P5 on oligodendrocytes in SPMS. The only biological friction is the CYP2C9 metabolic dependency (requiring genotyping), but this is a manageable clinical operational risk, not a toxicological hard stop."
Ozanimod,,S1P receptor modulator,S1P1 and S1P5 receptors,Multiple sclerosis,Approved,2020,,,approved,CNS,,approved_control,Approved controls (success),CC(C)OC1=C(C=C(C=C1)C2=NC(=NO2)C3=C4CC[C@@H](C4=CC=C3)NCCO)C#N,XRVDGNKRPOAQTN-FQEVSTJZSA-N,52938427,OK,2020.0,67,"Physicochemical audit reveals a molecule fighting against CNS design rules. While MW (404) and cLogP (~3.2) sit in the Goldilocks zone, the TPSA (~104 Å²) violates the strict <90 Å² limit for passive brain penetration, necessitating higher plasma levels to drive central occupancy. The scaffold contains a structural liability: the amino-indane moiety is a privileged pharmacophore for MAO-B inhibition, introducing a hypertensive crisis risk (tyramine effect) that complicates the safety profile. Additionally, the basic secondary amine tail, while aiding solubility, creates a vector for hERG channel blockade when coupled with the lipophilic bi-aryl system, reinforcing the cardiac stigma of the target class. Metabolic soft spots (hydroxyethyl oxidation, ether dealkylation) suggest a complex clearance profile. The mandatory 25-point penalty for target stigma, combined with the TPSA violation and MAO-B structural overlap, degrades the score significantly despite the high-quality synthetic execution. Tox Summary: Not Clean (MAO-B/Cardiac/CNS Permeability).",Medium,"Amino-indane (MAO-B pharmacophore), Hydroxyethyl-amine (metabolic oxidation/aldehyde formation), Basic amine (hERG liability).",0.65,"Safety profile is manageable but 'high maintenance', requiring intense cardiac monitoring (bradycardia) and exclusion of MAO interactions.",0.4,"Target engagement is likely, but the therapeutic window between S1P-driven efficacy and cardiac/MAO safety signals will be narrow, risking attrition.",0.2,Commercial viability severely hampered by likely 'first-dose' observation requirements and strict drug-drug interaction (DDI) labels regarding MAO inhibitors.,0.052,CAUTION,"This structure corresponds to Ozanimod. While S1P receptor modulation is a validated mechanism for Multiple Sclerosis and Ulcerative Colitis, the biology is inherently 'dirty' and high-maintenance. The class suffers from a legacy of cardiac toxicity (bradyarrhythmia/AV block) necessitating dose titration to mitigate first-dose effects, even with S1P1/5 selectivity over S1P3. Furthermore, the mechanism relies on lymphopenia (sequestration), carrying inherent risks of opportunistic infections (PML, viral reactivation). While the clinical dose is low (~1mg), which spares the liver from bulk-substrate toxicity, the molecule relies on complex metabolism to active species, introducing variability and MAO-B off-target liabilities (tyramine interaction). It is a clinically viable mechanism, but not a 'clean' one."
Teriflunomide,,DHODH inhibitor,Dihydroorotate dehydrogenase (DHODH),Multiple sclerosis,Approved,2012,,,approved,CNS,,approved_control,Approved controls (success),C/C(=C(\C#N)/C(=O)NC1=CC=C(C=C1)C(F)(F)F)/O,UTNUDOFZCWSZMS-YFHOEESVSA-N,54684141,OK,2012.0,78,"This molecule presents a deceptive profile: exceptional Ligand Efficiency (MW < 275) marred by a terrifying pharmacokinetic and safety liability. Structurally, the alpha-cyano-beta-hydroxy-acrylamide core functions as a vinylogous acid (pKa ~5.5), meaning the molecule is >99% ionized as an enolate anion at physiological pH. While this mimics a carboxylic acid bioisostere, it severely restricts passive BBB penetration, implying the 'CNS' efficacy is driven purely by peripheral lymphocyte depletion rather than central target engagement. Chemically, this core is an electron-deficient Michael Acceptor system; while resonance-stabilized, it remains a potential electrophilic trap for hepatic nucleophiles. The Bio-Advisory confirms the worst-case scenario: 'Zombie PK' (enterohepatic recirculation) leading to a 2-week half-life. In a modern discovery setting, a compound that refuses to be cleared and carries a structural alert for alkylation is a 'Hard Kill' for chronic indications. The high score reflects the massive management burden of the liver liability and teratogenicity risks, despite the high intrinsic potency. Tox Summary: NOT CLEAN (Hepatotoxic/Teratogenic risks).",High,"Alpha-cyano acrylamide (Michael Acceptor), 4-trifluoromethylaniline (potential hydrolysis release), Enolic nitrile (reactive electrophile).",0.3,Extreme half-life (2 weeks) observed in advisory makes dose escalation dangerous. Safety margins will be thin due to accumulation risks.,0.55,"Target validation (DHODH) is strong for the indication, and the molecule likely has high potency. Efficacy is probable if safety doesn't kill the program.",0.15,"Chronic dosing of a hepatotoxic Michael acceptor with 'roach motel' pharmacokinetics (checks in, doesn't check out) invites Black Box warnings and restricted labeling.",0.025,CAUTION,"This structure is Teriflunomide, the active metabolite of Leflunomide. While DHODH is a validated target for Relapsing-Remitting Multiple Sclerosis (limiting de novo pyrimidine synthesis in activated lymphocytes), the biological liability is significant. The molecule undergoes extensive enterohepatic recirculation, resulting in a half-life of ~2 weeks. This pharmacokinetic persistence turns the liver into a hostage; if DILI occurs, rapid washout requires cholestyramine. While the daily dose is low (14mg), saving it from immediate 'TERMINATE' status, the Black Box warnings for hepatotoxicity and teratogenicity represent a high clinical management burden."
Apixaban,,Factor Xa inhibitor,Activated Factor X (FXa),Anticoagulation,Approved,2012,,,approved,Cardiovascular,,approved_control,Approved controls (success),COC1=CC=C(C=C1)N2C3=C(CCN(C3=O)C4=CC=C(C=C4)N5CCCCC5=O)C(=N2)C(=O)N,QNZCBYKSOIHPEH-UHFFFAOYSA-N,10182969,OK,2012.0,3,"This structure is a masterclass in 'Neutral Design' and rigidification. By utilizing a fused bicyclic lactam core (tetrahydro-pyrazolo-pyridinone) and flanking N-linked aryl systems without introducing a single basic amine, the architect has effectively eliminated hERG liability and phospholipidosis risk (pKa < 7). The molecule is achiral, a massive CMC advantage that simplifies manufacturing and eliminates enantiomeric switching risks. The physicochemical profile is 'Goldilocks': cLogP is likely < 2.5, and TPSA ~110 Å² restricts CNS entry (highly desirable for a peripheral anticoagulant to avoid CNS bleeding complications). The high rigidity suggests a low entropic binding penalty, supporting the 'Elite' potency claim. Metabolic soft spots are limited to O-demethylation (anisole) and potential lactam oxidation, but the low lipophilicity suggests high metabolic stability. With a predicted dose < 10mg, the DILI risk is negligible. This is a boring molecule, which is the highest compliment I can give. Tox Summary: Clean.",High,None. (N-phenyl lactams are stable and non-genotoxic; Anisole is a standard metabolic handle).,0.92,Pristine structural hygiene. Neutral character removes hERG risk. Low lipophilicity reduces off-target binding. Achirality simplifies formulation.,0.85,Validated mechanism (Factor Xa) combined with a scaffold optimized for high LipE and oral bioavailability. Target engagement is virtually guaranteed.,0.78,"Low dose burden (<10mg) insulates against idiosyncratic toxicity. Main risk is mechanism-based bleeding (PD), which is monitorable.",0.61,ELITE,"Factor Xa is a clinically validated, 'de-risked' mechanism. This scaffold is structurally analogous to Apixaban (Eliquis), implying nanomolar potency and a low clinical dose requirement (<10mg BID). Low dose burden significantly reduces the probability of idiosyncratic DILI or off-target toxicity. The primary risk is mechanism-based bleeding, which is a known, monitorable pharmacodynamic endpoint, not a black-box safety signal. Unlike the graveyards of CETP or BACE1, this pathway works."
Rivaroxaban,,Factor Xa inhibitor,Activated Factor X (FXa),Anticoagulation,Approved,2011,,,approved,Cardiovascular,,approved_control,Approved controls (success),C1COCC(=O)N1C2=CC=C(C=C2)N3C[C@@H](OC3=O)CNC(=O)C4=CC=C(S4)Cl,KGFYHTZWPPHNLQ-AWEZNQCLSA-N,9875401,OK,2011.0,3,"This is a masterclass in 'Anti-Grease' medicinal chemistry. The structure is a 'string of pearls' topology—three rings linked by rigid spacers—designed to span a binding pocket without relying on non-specific hydrophobic collapse. 

1. **Physicochemical Hygiene**: The molecule is remarkably polar for a drug candidate (cLogP ~1.5-2.0), yet maintains a MW < 450. This sits squarely in the 'Goldilocks' zone for oral bioavailability. The use of a morpholinone and an oxazolidinone as scaffold elements introduces significant polarity and hydrogen bond acceptors, ensuring high solubility and low non-specific binding. 

2. **Structural De-Risking**: The central phenyl ring is flanked by two nitrogen atoms, but crucially, both are part of cyclic amide/carbamate systems (morpholinone and oxazolidinone). This electronically deactivates the aniline nitrogens, effectively eliminating the risk of quinone-imine formation or mutagenicity often associated with poly-aromatic amines. 

3. **The Thiophene Gamble**: The 5-chlorothiophene moiety is the only structural alert. Thiophenes are notorious for metabolic activation (S-oxidation, ring opening). However, the strategic placement of the Chlorine atom at the C5 position blocks the primary metabolic soft spot and withdraws electron density, stabilizing the ring against oxidative attack. While a potential liability, the low projected dose (<20mg) renders this risk manageable. 

4. **hERG & Safety**: The molecule is neutral/weakly acidic. It lacks the basic amine required for the hERG pharmacophore. Cardiac safety risk is minimal. 

**Verdict**: High LipE, metabolically hardened, and physicochemically elite. A textbook example of modern drug design.",High,"Chlorothiophene (potential S-oxidation/epoxidation risk, mitigated by Cl-substitution)",0.92,"Pristine safety profile. Neutral molecule eliminates hERG risk. Metabolic soft spots are blocked. Unless there is an unforeseen off-target hit, this sails through Phase 1.",0.75,Mechanism is validated (Factor Xa). PK properties (solubility/permeability balance) suggest excellent exposure. Efficacy is highly probable.,0.65,"Commercial viability is high. The main risk is the extension of pharmacology (bleeding events), which is a class effect, not a molecule-specific toxicity. Low dose (<20mg) protects against idiosyncratic DILI.",0.88,ELITE,"Factor Xa is a clinically validated 'Gold Standard' target for anticoagulation (e.g., Apixaban, Rivaroxaban). Unlike the graveyards of BACE1 or CETP, this mechanism works. The primary risk is on-target bleeding, which is a monitorable extension of pharmacology, not an idiosyncratic black box. The chemical scaffold (oxazolidinone/morpholinone) implies high potency, allowing for a low clinical dose (<20mg/day). This keeps the total hepatic burden well below the >100mg threshold associated with DILI. Biologically, this is a solved problem."
